bookID,title,authors,language_code,num_pages,publication_date
10057,Sid and Nancy: Love Kills,Alex Cox/Abbe Wool,eng,143,12/31/1986
10058,Flags of Our Fathers,James D. Bradley/Ron Powers,eng,382,8/29/2006
10061,Flags of Our Fathers: A Young People's Edition,Michael R. French/Ron Powers/James D. Bradley,eng,224,08/01/2006
10073,A Long Way Down,Nick Hornby,eng,368,05/02/2006
10075,Clockwork (Cover to Cover),Philip Pullman,eng,0,7/29/2002
10079,Mary Queen of Scots,Antonia Fraser,eng,568,09/01/1993
10080,Mary Queen of Scots and the Murder of Lord Darnley,Alison Weir,eng,640,02/05/2004
10083,On the Trail of Mary  Queen of Scots,J. Keith Cheetham,eng,192,06/01/1999
10084,River of Blue Fire (Otherland  #2),Tad Williams,eng,675,09/01/1999
10089,Mary  Queen of Scots: Queen Without a Country,Kathryn Lasky,eng,202,05/01/2002
10090,Mountain of Black Glass (Otherland  #3),Tad Williams,eng,749,09/12/2000
10096,Mary  Queen of Scots: Pride  Passion and a Kingdom Lost,Jenny Wormald,eng,224,05/04/2001
10097,Queen of Scots: The True Life of Mary Stuart,John Guy,eng,581,04/07/2004
10105,The Last Wife of Henry VIII,Carolly Erickson,eng,326,10/03/2006
10106,The Children of Henry VIII,Alison Weir,eng,385,07/08/1997
10107,The Last Days of Henry VIII,Robert Hutchinson,eng,368,9/20/2005
10108,The Autobiography of Henry VIII: With Notes by His Fool  Will Somers,Margaret George,eng,939,9/15/1998
10112,Henry VIII (Shakespeare  Pelican),William Shakespeare/Stephen Orgel,eng,126,08/01/2001
10115,The Memoirs of Cleopatra,Margaret George,eng,1139,01/10/1998
10118,Saint George and the Dragon,Margaret Hodges/Trina Schart Hyman,eng,32,09/04/1990
10126,Kiss Me Like a Stranger: My Search for Love and Art,Gene Wilder,eng,261,03/07/2006
10134,Wie ich eines schönen Morgens im April das 100%ige Mädchen sah,Haruki Murakami/Nora Bierich,ger,218,08/01/1998
10147,The Complete Sherlock Holmes  Volume I,Arthur Conan Doyle/Kyle Freeman,eng,709,09/01/2003
10148,The Complete Sherlock Holmes  Volume II,Arthur Conan Doyle/Kyle Freeman,eng,709,10/01/2003
10156,The Last of Her Kind,Sigrid Nunez,eng,391,12/12/2006
10165,Anatomy of Love: A Natural History of Mating  Marriage  and Why We Stray,Helen Fisher,eng,432,01/03/1994
10170,The Devil's in the Details (A Camilla MacPhee Mystery  #4),Mary Jane Maffini,eng,320,10/01/2004
10172,Wigfield: The Can-Do Town That Just May Not,Amy Sedaris/Stephen Colbert/Paul Dinello,eng,5,5/19/2004
10173,The SantaLand Diaries and Season's Greetings,David Sedaris/Joe Mantello,eng,54,12/01/1998
10174,Jenny and the Jaws of Life: Short Stories,Jincy Willett/David Sedaris,eng,272,9/14/2002
10200,Venac sonetnih venaca; Puževa srma,Dobrica Erić,srp,222,01/01/1996
10203,View With a Grain of Sand: Selected Poems,Wisława Szymborska/Stanisław Barańczak/Clare Cavanagh,eng,214,5/26/1995
10204,View with a Grain of Sand: Selected Poems,Wisława Szymborska,eng,214,10/23/1996
10205,Poems New and Collected,Wisława Szymborska/Clare Cavanagh,eng,296,11/16/2000
10206,Sounds  Feelings  Thoughts:  Seventy Poems by Wislawa Szymborska,Wisława Szymborska/Magnus J. Kruyski,eng,232,8/21/1981
10208,Miracle Fair: Selected Poems,Wisława Szymborska/Joanna Trzeciak/Czesław Miłosz,eng,159,11/17/2002
10210,Jane Eyre,Charlotte Brontë/Michael Mason,eng,532,02/04/2003
10215,The Far Pavilions,M.M. Kaye,eng,0,12/12/1988
10217,Death in Kashmir,M.M. Kaye,eng,256,12/01/2000
10219,The Sun in the Morning: My Early Years in India and England,M.M. Kaye,eng,454,09/01/1990
10220,Death in the Andamans,M.M. Kaye,eng,272,02/11/2000
10221,Death in Berlin,M.M. Kaye,eng,272,06/08/2000
10222,The Far Pavilions,M.M. Kaye,eng,958,1/15/1997
10224,Enchanted Evening,M.M. Kaye,eng,368,12/05/2000
10232,Pathologies of Power: Health  Human Rights and the New War on the Poor,Paul Farmer/Amartya Sen,eng,438,11/22/2004
10233,Infections and Inequalities: The Modern Plagues,Paul Farmer,eng,424,2/23/2001
10235,Mountains Beyond Mountains: The Quest of Dr. Paul Farmer  a Man Who Would Cure the World,Tracy Kidder,eng,333,8/31/2004
10238,The Tao of Physics: An Exploration of the Parallels between Modern Physics and Eastern Mysticism,Fritjof Capra,eng,366,01/04/2000
10255,Dr. Mary's Monkey: How the Unsolved Murder of a Doctor  a Secret Laboratory in New Orleans and Cancer-Causing Monkey Viruses are Linked to Lee Harvey Oswald  the JFK Assassination and Emerging Global Epidemics,Edward T. Haslam/Jim Marrs,eng,374,04/01/2007
10261,The Art of Richard P. Feynman,Michelle Feynman,eng,174,07/01/1995
10263,The Early History of God: Yahweh and the Other Deities in Ancient Israel,Mark S. Smith/Patrick D. Miller,eng,243,8/28/2002
10269,Haiti  History  and the Gods,Joan Dayan/Colin Dayan,eng,362,03/10/1998
10270,Acts of God: The Unnatural History of Natural Disaster in America,Ted Steinberg,eng,309,06/01/2006
10285,The World's Religions,Huston Smith,eng,416,9/13/1991
10289,Introduction to World Religions,Christopher Partridge,eng,495,3/24/2005
10303,FDR's Folly: How Roosevelt and His New Deal Prolonged the Great Depression,Jim  Powell,eng,352,9/28/2004
10308,Folly and Glory (The Berrybender Narratives  #4),Larry McMurtry,eng,358,08/08/2005
10310,The Argumentative Indian: Writings on Indian History  Culture and Identity,Amartya Sen,eng,432,09/05/2006
10311,Argumentative Indian: Writings On Indian History Culture And Identity,Amartya Sen,eng,391,6/28/2005
10324,Things to Bring  S#!t to Do: And Other Inventories of Anxiety: My Life in Lists,Karen Rizzo,eng,160,10/01/2006
10329,Dumpy's Valentine,Julie Andrews Edwards/Emma Walton Hamilton/Tony Walton/Ruby Randig,eng,24,12/12/2006
10332,Mandy,Julie Andrews Edwards/Johanna Westerman,eng,320,8/15/2006
10340,Giraffes Can't Dance,Giles Andreae/Guy Parker-Rees/Hugh Laurie,eng,32,06/01/2006
10346,The Medici Giraffe and Other Tales of Exotic Animals and Power,Marina Belozerskaya,eng,414,8/21/2006
10347,The Giraffe Who Was Afraid of Heights (Physical & Behavioral Adaptation),David A. Ufer/Kirsten Carlson,eng,32,06/01/2006
10370,Where the Red Fern Grows with Connections,Wilson Rawls/Rafe Martin/Borden Deal/Kemp P. Battle/Robert Bethke/Harold Courlander/Maya Angelou/Nicholasa Mohr/Dick Perry/John R. Erickson,eng,288,09/01/1998
10372,Summer of the Monkeys,Wilson Rawls,eng,288,12/29/1998
10382,Dreams from My Father: A Story of Race and Inheritance,Barack Obama,eng,442,01/09/2007
10403,Doctor Who: Cat's Cradle-Time's Crucible,Marc Platt,eng,275,2/20/1992
10404,Doctor Who: Cat's Cradle-Witch Mark,Andrew    Hunt,eng,256,6/18/1992
10405,Doctor Who: Cat's Cradle-Warhead,Andrew Cartmel,eng,262,4/16/1992
10412,He's Just Not That Into You: The No-Excuses Truth to Understanding Guys,Greg Behrendt/Liz Tuccillo,eng,208,12/26/2006
10414,Do Not Open This Book,Michaela Muntean/Pascal Lemaître,eng,40,03/01/2006
10416,Not Your Mother's Slow Cooker Cookbook,Beth Hensperger/Julie Kaufmann,eng,520,12/21/2004
10417,Hands Are Not for Hitting (Ages 4-7),Martine Agassi/Marieka Heinlen,eng,35,02/01/2001
10420,Not So Big House,Sarah Susanka/Kira Obolensky,eng,208,4/20/2001
10421,Rodinsky's Room,Rachel Lichtenstein/Iain Sinclair,eng,362,02/01/2000
10427,The Rough Guide to Cuba 3,Fiona McAuslan/Matthew  Norman,eng,640,6/20/2005
10429,Cuba: A New History,Richard Gott,en-GB,384,11/11/2005
10431,Cuba 15,Nancy Osa,eng,304,03/08/2005
10433,Cuba (Jake Grafton #7),Stephen Coonts,eng,461,5/15/2000
10441,The Memory Keeper's Daughter,Kim Edwards,eng,401,5/30/2006
10445,Too Far to Go: The Maples Stories,John Updike,eng,256,06/12/1982
10456,Far to Go (Margaret Thursday  #2),Noel Streatfeild,eng,161,02/01/1986
10460,The Children on the Top Floor,Noel Streatfeild,en-GB,180,07/01/1985
10461,Desolation Angels,Jack Kerouac/Joyce Johnson,eng,432,09/01/1995
10464,Healing With Whole Foods: Asian Traditions and Modern Nutrition,Paul Pitchford,eng,784,11/05/2002
10471,The New Whole Foods Encyclopedia: A Comprehensive Resource for Healthy Eating,Rebecca  Wood/Paul Pitchford,eng,464,07/01/1999
10474,The Discomfort Zone: A Personal Journey,Jonathan Franzen,eng,6,8/28/2006
10476,The Parrot's Lament  and Other True Tales of Animal Intrigue  Intelligence  and Ingenuity,Eugene Linden,eng,224,08/01/2000
10490,Postscript to the Name of the Rose,Umberto Eco,eng,84,01/01/1984
10495,El nombre de la rosa,Umberto Eco,spa,782,2/28/2006
10500,Baby Names for Dummies,Margaret  Rose/Heather Rose Jones,eng,364,05/01/2005
10503,The Mysterious Flame of Queen Loana,Umberto Eco/Geoffrey Brock,eng,480,06/05/2006
10505,History of Beauty,Umberto Eco/Girolamo De Michele/Alastair McEwen/Agnolo di Cosimo Bronzino,eng,432,11/13/2004
10507,Baudolino,Umberto Eco/William Weaver/R.C.S. Libri,eng,527,10/06/2003
10514,Travels in Hyperreality,Umberto Eco/John Radziewicz/William Weaver,eng,324,5/27/1990
10517,How to Travel with a Salmon and Other Essays,Umberto Eco/William Weaver,eng,256,9/15/1995
10518,A Theory of Semiotics,Umberto Eco,eng,368,02/01/1978
10519,Art and Beauty in the Middle Ages,Umberto Eco/Hugh Bredin,eng,144,02/08/2002
10525,Mouse or Rat?: Translation as Negotiation,Umberto Eco,eng,208,9/28/2004
10528,The Role of the Reader: Explorations in the Semiotics of Texts,Umberto Eco,eng,288,7/22/1979
10529,Libraries,Candida Höfer/Umberto Eco,eng,271,8/20/2014
10534,The Art of War,Sun Tzu/Thomas Cleary/Pulat Otkan/Giray Fidan,eng,273,01/11/2005
10536,Sun Tzu: The Art of War for Managers; 50 Strategic Rules,Sun Tzu/Gerald A. Michaelson,eng,224,01/01/2001
10537,The Art of War,Sun Tzu/Ralph D. Sawyer,eng,5,06/01/2003
10539,The Lost Continent:  Travels in Small-town America,Bill Bryson,eng,379,01/02/1999
10541,Made in America: An Informal History of the English Language in the United States,Bill Bryson,eng,364,10/23/2001
10545,Ulysses,James Joyce/Declan Kiberd,eng,933,3/30/2000
10546,The Long-Lost Map (Ulysses Moore #2),Pierdomenico Baccalario/Iacopo Bruno/Leah D. Janeczko,eng,272,07/01/2006
10552,The Wicked Wit of Charles Dickens,Shelley Klein/Charles Dickens,eng,162,09/01/2002
10559,The Three Musketeers,Alexandre Dumas/Barbara T. Cooper,eng,761,11/25/2004
10561,The Three Musketeers,Alexandre Dumas/Michael Page,eng,24,7/25/2005
10562,The Three Musketeers (Great Illustrated Classics),Malvina G. Vogel/Alexandre Dumas,eng,236,12/03/2005
10563,The Three Musketeers (The d'Artagnan Romances. #1),Alexandre Dumas/Keith Wren,eng,592,05/05/2001
10566,Lisey's Story,Stephen King,eng,513,10/24/2006
10568,King Arthur Flour Whole Grain Baking: Delicious Recipes Using Nutritious Whole Grains,King Arthur Flour,eng,544,10/09/2006
10570,King Dork (King Dork  #1),Frank Portman,eng,344,04/11/2006
10572,A Clash of Kings  (A Song of Ice and Fire  #2),George R.R. Martin,eng,969,5/28/2002
10574,The Colorado Kid,Stephen King,eng,178,2/20/2006
10575,Stationary Bike,Stephen King/Ron McLarty,eng,44,07/01/2006
10579,Everything's Eventual: 14 Dark Tales,Stephen King,eng,605,11/01/2005
10581,The Mist,Stephen King/ZBS Foundation,eng,2,09/01/1993
10583,Pet Sematary,Stephen King,eng,576,11/01/2005
10585,Insomnia,Stephen King/Bettina Blanch Tyroller,spa,890,2/28/2005
10586,The Stephen King Collection: Stories from Night Shift,Stephen King/John  Glover,eng,11,02/08/2005
10587,The Man in the Black Suit: 4 Dark Tales,Stephen King/Ana Juan/John Cullum/Becky Ann Baker/Íñigo Jáuregui/Peter Gerety/Arliss Howard,eng,128,11/01/2002
10593,The Shining,Stephen King/Campbell Scott,eng,16,08/02/2005
10594,Stephen King: America's Best-Loved Boogeyman,George Beahm,eng,304,05/01/1998
10597,The Illustrated Stephen King Trivia Book,Brian James Freeman/Bev Vincent/Glenn Chadbourne,eng,404,05/01/2005
10599,Gray Matter and Other Stories from Night Shift,Stephen King/John  Glover,eng,0,08/01/1993
10603,Cujo,Stephen King,spa,432,06/06/2006
10605,Thinner,Richard Bachman/Stephen King,eng,320,09/01/1996
10606,Stephen King from A to Z: An Encyclopedia of His Life and Work,George Beahm,eng,251,3/31/1999
10607,Black House (The Talisman  #2),Stephen King/Peter Straub,eng,688,9/30/2003
10612,The Stephen King Universe: A Guide to the Worlds of the King of Horror,Stanley Wiater/Christopher Golden/Hank Wagner,eng,478,5/21/2001
10613,Night Shift,Stephen King,eng,326,02/01/1979
10614,Misery,Stephen King,eng,370,11/01/1988
10617,The Bachman Books,Richard Bachman/Stephen King,eng,704,10/01/1996
10620,Misery,Stephen King/María Mir,spa,368,3/26/2002
10622,Carrie,Stephen King,eng,253,10/01/1999
10624,"Four Past Midnight: Featuring ""The Langoliers""",Stephen King,eng,761,05/01/1995
10629,Christine,Stephen King/Marie Milpois,fre,411,6/13/2001
10631,Sam Walton: Made In America,Sam Walton/John Huey,eng,346,06/01/1993
10638,The Road to Reality: A Complete Guide to the Laws of the Universe,Roger Penrose,eng,1099,01/09/2007
10639,The Paradox of Choice: Why More Is Less,Barry Schwartz,eng,265,1/18/2005
10654,Coach: Lessons on the Game of Life,Michael   Lewis,eng,96,4/17/2005
10655,Losers: The Road to Everyplace But the White House,Michael   Lewis,eng,320,7/28/1998
10656,Next: The Future Just Happened,Michael   Lewis,eng,240,5/17/2002
10662,The Ends of the Earth: A Journey to the Frontiers of Anarchy,Robert D. Kaplan,eng,496,1/28/1997
10663,Salvation to the Ends of the Earth: A Biblical Theology of Mission (New Studies in Biblical Theology (InterVarsity Press)  #11),Andreas J. Köstenberger/Peter T. O'Brien,eng,351,01/01/2001
10666,The Ends Of The Earth: A Journey At The Dawn Of The 21st Century,Robert D. Kaplan,eng,476,2/27/1996
10669,When Genius Failed: The Rise and Fall of Long-Term Capital Management,Roger Lowenstein,eng,264,10/09/2001
10670,When Genius Failed: The Rise And Fall Of Long Term Capital Management,Roger Lowenstein,eng,275,06/01/2009
10682,The Secret of Fantasy Forest (Sweet Valley Kids #67),Francine Pascal/Molly Mia Stewart/Ying-Hwa Hu,eng,96,09/01/1996
10686,Pearl and Wagner: Three Secrets,Kate McMullan/Janet Allison Brown/R.W. Alley,eng,48,5/24/2004
10687,A History of Britain: The Fate Of Empire 1776-2000 (A History of Britain  #3),Simon Schama,eng,576,12/18/2002
10689,The Devil in the White City Murder  Magic and Madness at the Fair that Changed America,Erik Larson,eng,464,03/03/2003
10691,O Historiador,Elizabeth Kostova,por,544,8/19/2005
10698,Kim,Rudyard Kipling/Jeffrey Meyers,eng,286,12/15/2003
10701,Birds Without Wings,Louis de Bernières,eng,640,07/01/2004
10711,God Knows,Joseph Heller,eng,368,11/12/1997
10712,Picture This,Joseph Heller,eng,352,3/24/2000
10713,Closing Time,Joseph Heller,eng,464,07/01/2003
10714,Good as Gold,Joseph Heller,eng,445,11/12/1997
10718,Something Happened,Joseph Heller,eng,576,11/12/1997
10732,Archie Americana Series: Best of the Eighties  Vol. 1,George Gladir/John L. Goldwater/Steve Geppi/Michael I. Silberkleit,eng,96,6/26/2001
10739,The Moviegoer,Walker Percy,eng,242,4/14/1998
10750,Wicked: The Life and Times of the Wicked Witch of the West,Gregory Maguire/Douglas Smith,eng,409,03/02/2004
10751,Wicked: Memorias de una bruja mala (Los años malvados  #1),Gregory Maguire/Claudia Conde,spa,508,05/01/2007
10756,The Sword and the Shield: The Mitrokhin Archive & the Secret History of the KGB,Christopher M. Andrew/Vasili Mitrokhin,eng,736,8/29/2000
10757,Lay Down My Sword And Shield (Hackberry Holland  #1),James Lee Burke,eng,320,09/04/2003
10760,Sword and Shield,John Terra,eng,16,09/01/1992
10765,A Year in the Merde,Stephen Clarke,eng,276,05/02/2006
10767,Merde!: The Real French You Were Never Taught at School,Geneviève/Michael    Heath,eng,112,12/09/1998
10770,Merde Encore!: More of the Real French You Were Never Taught at School,Geneviève/Michael    Heath,eng,104,12/09/1998
10772,Can't Wait to Get to Heaven,Fannie Flagg/Cassandra Campbell,eng,384,7/18/2006
10776,Green Hills of Africa,Ernest Hemingway/Edward Shenton,eng,200,03/04/2004
10778,Across the River and into the Trees,Ernest Hemingway,eng,272,4/15/1998
10780,Hemingway: The Paris Years,Michael S. Reynolds,eng,402,5/17/1999
10783,Adios Hemingway,Leonardo Padura/John King,eng,229,03/10/2006
10785,By-Line: Selected Articles and Dispatches of Four Decades,Ernest Hemingway/William M. White,eng,512,05/12/1998
10787,The Hemingway Women: Those Who Love Him - The Wives And Others,Bernice Kert,eng,556,12/17/1998
10789,Hemingway: A Biography,Jeffrey Meyers,eng,644,05/07/1999
10792,The Sword of Straw (The Sangreal Trilogy  #2),Amanda Hemingway,eng,336,3/28/2006
10796,A Farewell to Arms,Ernest Hemingway/John Slattery,eng,8,05/01/2006
10797,A Farewell to Arms,Ernest Hemingway,eng,336,02/01/1982
10801,The Big Rock Candy Mountain,Wallace Stegner,eng,563,03/01/1991
10802,Beyond the Hundredth Meridian: John Wesley Powell and the Second Opening of the West,Wallace Stegner/Bernard DeVoto,eng,438,03/01/1992
10804,Collected Stories,Wallace Stegner/Lynn Stegner,eng,576,7/25/2006
10805,All the Little Live Things,Wallace Stegner,eng,345,12/01/1991
10806,Where the Bluebird Sings to the Lemonade Springs,Wallace Stegner/T.H. Watkins,eng,234,04/09/2002
10808,Wallace Stegner: His Life and Work,Jackson J. Benson,eng,496,11/01/1997
10810,Letters of E.B. White,E.B. White/Dorothy Lobrano Guth/Martha White/John Updike,eng,736,11/28/2006
10814,Here Is New York,E.B. White/Roger Angell/Barbara Cohen/Judith Stonehill,eng,58,01/01/2000
10826,Charlotte's Web,E.B. White/Garth Williams,eng,179,11/01/2006
10832,Charlotte's Web,E.B. White/Garth Williams,eng,256,10/28/1993
10836,Che Guevara: A Revolutionary Life,Jon Lee Anderson/José Hernández/Leena Nivala,eng,814,03/09/1998
10846,Gatsby's Girl,Caroline Preston,eng,312,05/01/2006
10853,In Search of Captain Zero: A Surfer's Road Trip Beyond the End of the Road,Allan C. Weisbecker,eng,352,9/16/2002
10863,Pipe Dream (Strivers Row),Solomon Jones,eng,341,7/31/2001
10867,The Pleasure of My Company,Steve Martin,eng,176,10/06/2004
10873,Shopgirl,Steve Martin,eng,130,01/01/2000
10876,The Mutineer: Rants  Ravings  and Missives from the Mountaintop  1977-2005,Hunter S. Thompson,eng,752,03/01/2013
10877,Generation of Swine: Tales of Shame and Degradation in the '80's,Hunter S. Thompson,eng,336,11/06/2003
10879,The Gonzo Way: A Celebration of Dr. Hunter S. Thompson,Anita Thompson,eng,112,07/01/2007
10880,The Proud Highway: Saga of a Desperate Southern Gentleman  1955-1967,Hunter S. Thompson/Douglas Brinkley,eng,720,04/07/1998
10884,Einstein: His Life and Universe,Walter Isaacson,eng,675,04/10/2007
10885,The Wise Men: Six Friends and the World They Made,Walter Isaacson/Evan Thomas,eng,864,06/04/1997
10887,Kissinger,Walter Isaacson,eng,896,9/27/2005
10890,Traveling Mercies: Some Thoughts on Faith,Anne Lamott,eng,275,2/15/2000
10894,Where Rainbows End,Cecelia Ahern,eng,454,11/08/2004
10895,Irish Girls Are Back in Town,Cecelia Ahern/Patricia Scanlan/Gemma O'Connor/Sarah Webb/Maeve Binchy/Marian Keyes/Morag Prunty/Cathy Kelly/Colette Caddle/Marita Conlon-McKenna/Martina Devlin/Clare Dowling/Catherine Foley/Aine Greaney/Suzanne Higgins/Rosaleen Linehan/Joan O'Neill/Julie Parsons/Deirdre Purcell/Martina Reilly/Mary Ryan/Annie Sparrow/Una Brankin,eng,384,03/01/2005
10897,There's No Place Like Here,Cecelia Ahern,eng,340,09/04/2007
10906,Final Rain (The Survivalist  #19),Jerry Ahern,eng,220,06/01/1989
10907,The Pursuit of Happyness,Chris Gardner,eng,320,10/24/2006
10908,Harvesting the Heart,Jodi Picoult,eng,453,04/01/1995
10909,The Tenth Circle,Jodi Picoult,eng,416,10/24/2006
10910,Mercy,Jodi Picoult,eng,400,04/01/2001
10912,Picture Perfect,Jodi Picoult,eng,369,07/02/2002
10914,Songs of the Humpback Whale,Jodi Picoult,eng,346,10/01/2001
10915,Salem Falls,Jodi Picoult,eng,434,08/01/2002
10916,The Pact,Jodi Picoult,eng,512,8/29/2006
10917,My Sister's Keeper,Jodi Picoult,eng,423,02/01/2005
10920,Cold Mountain,Charles Frazier,eng,356,09/01/2006
10921,The Collected Songs of Cold Mountain,Hanshan/Red Pine/John Blofeld,eng,320,06/01/2000
10929,For One More Day,Mitch Albom,eng,197,9/26/2006
10932,Just One More Day: A Memoir,Susan    Lewis,eng,340,01/05/2006
10939,Ya Sé Que Te Quiero,Billy Crystal/Elizabeth Sayles,spa,40,04/11/2006
10943,Absolutely Mahvelous,Billy Crystal/Dick Schaap,eng,128,7/18/1986
10951,The Last Innocent Man,Phillip Margolin,eng,352,1/25/2005
10964,Outlander (Outlander  #1),Diana Gabaldon,eng,850,7/26/2005
10965,A Breath of Snow and Ashes (Outlander  #6),Diana Gabaldon,eng,980,8/29/2006
10966,Outlander - The Exile of Sharad Hett (Star Wars: Ongoing  Volume 2),Timothy Truman/Rick Leonardi/Tom Raney/Al Rio,eng,144,4/18/2001
10967,The Fiery Cross (Outlander  #5),Diana Gabaldon/Janos Farkas,eng,1443,8/30/2005
10968,Refuge (Outlanders  #36),James Axler,eng,346,2/14/2006
10969,Dragonfly in Amber (Outlander  #2),Diana Gabaldon,eng,743,07/01/1992
10970,Outlander,Matt Keefe,eng,254,12/26/2006
10971,Hydra's Ring (Outlanders  #39),James Axler,eng,348,11/01/2006
10972,Omega Path (Outlanders  #4),James Axler,eng,352,1/23/1998
10973,Savage Sun (Outlanders  #3),James Axler,eng,352,10/24/1997
10974,As I Lay Dying,William Faulkner/E.L. Doctorow,eng,231,1/25/2001
10976,Novels  1926-1929,William Faulkner/Noel Polk/Joseph Blotner,eng,1180,04/06/2006
10979,Light in August,William Faulkner,eng,507,1/30/1991
10980,Novels 1942–1954: Go Down  Moses / Intruder in the Dust / Requiem for a Nun / A Fable,William Faulkner/Noel Polk/Joseph Blotner,eng,1110,10/01/1994
10982,Selected Short Stories,William Faulkner,eng,320,5/18/1993
10984,Three Famous Short Novels: Spotted Horses Old Man the Bear,William Faulkner,eng,320,02/12/1958
10985,The Town,William Faulkner,eng,371,02/12/1961
10987,Voyager (Outlander  #3),Diana Gabaldon,eng,870,08/07/2001
10988,Drums of Autumn (Outlander  #4),Diana Gabaldon,eng,880,08/07/2001
10989,The Outlandish Companion: Companion to Outlander  Dragonfly in Amber  Voyager  and Drums of Autumn,Diana Gabaldon,eng,577,6/29/1999
10990,Lord John and the Private Matter (Lord John Grey  #1),Diana Gabaldon,eng,368,10/04/2005
10992,Cross Stitch (Outlander  #1),Diana Gabaldon,eng,864,03/03/1994
10993,The Eight,Katherine Neville,eng,624,6/23/1997
10996,Your Eight Year Old: Lively and Outgoing,Louise Bates Ames/Frances L. Ilg/Carol C. Haber/Betty David,eng,160,03/01/1990
11000,Eight Mindful Steps to Happiness: Walking the Buddha's Path,Henepola Gunaratana,eng,288,6/15/2001
11002,Eight Men Out: The Black Sox and the 1919 World Series,Eliot Asinof/Stephen Jay Gould,eng,336,05/01/2000
11003,Eleven on Top (Stephanie Plum  #11),Janet Evanovich,eng,321,6/20/2006
11005,El Clan Del Oso Cavernario,Jean M. Auel/Leonor Tejada Conde-Pelayo,spa,548,09/01/1981
11006,The Portable James Joyce,James Joyce/Harry Levin,eng,762,8/20/1986
11012,Dubliners,James Joyce/Jeri Johnson/Thiên Lương,eng,207,3/15/2001
11013,Finnegans Wake,James Joyce,eng,628,11/04/2002
11016,Jane Eyre,Charlotte Brontë/Stevie Davies,eng,590,6/29/2006
11019,Jane Eyre,Charlotte Brontë/Richard J. Dunn,eng,534,12/13/2000
11021,Jane Eyre,Jane E. Gerver/Bill Dodge/Charlotte Brontë,eng,112,6/17/1997
11022,Purity of Blood (Adventures of Captain Alatriste  #2),Arturo Pérez-Reverte/Margaret Sayers Peden,eng,268,11/28/2006
11026,Barnaby Rudge,Charles Dickens/John Bowen/Hablot Knight Browne,eng,744,2/27/2003
11027,No me cogeréis vivo: artículos 2001-2005,Arturo Pérez-Reverte,spa,537,11/10/2005
11031,The Flanders Panel,Arturo Pérez-Reverte/Margaret Jull Costa,eng,295,06/07/2004
11033,The Seville Communion,Arturo Pérez-Reverte/Sonia Soto,eng,400,06/07/2004
11036,Little Birds,Anaïs Nin,eng,148,02/02/2004
11037,The Diary of Anaïs Nin  Vol. 2: 1934-1939,Anaïs Nin/Gunther Stuhlmann,eng,372,3/25/1970
11038,"Henry and June: From ""A Journal of Love"": The Unexpurgated Diary of Anaïs Nin  1931-1932",Anaïs Nin,eng,304,10/29/1990
11043,House of Incest,Anaïs Nin/Val Telberg,eng,72,02/01/1991
11044,The Diary of Anaïs Nin  Vol. 3: 1939-1944,Anaïs Nin/Gunther Stuhlmann,eng,348,3/24/1971
11045,The Spectator Bird,Wallace Stegner,eng,214,11/01/1990
11047,The Big Book of Boy Stuff,Bart King/Chris Sabatino,eng,292,07/01/2004
11048,The Boys of Everest: Chris Bonington and the Tragedy of Climbing's Greatest Generation,Clint Willis,eng,535,9/14/2006
11062,Roald Dahl: The Storyteller (Famous Lives),Jason Hook,eng,48,08/12/2004
11069,Les Nouvelles Recettes irrésistibles de Roald Dahl,Roald Dahl/Quentin Blake,fre,64,9/18/2002
11071,Relatos de lo inesperado,Roald Dahl/Carmelina Payá/Antonio Samons,spa,320,6/30/2016
11075,Konfetti Ungemütliches + Ungezogenes,Roald Dahl,ger,123,01/02/1987
11077,The Sex Lives of Cannibals: Adrift in the Equatorial Pacific,J. Maarten Troost,eng,272,06/08/2004
11089,The Read-Aloud Handbook,Jim Trelease,eng,432,7/25/2006
11095,The Working Poor: Invisible in America,David K. Shipler,eng,352,01/04/2005
11101,First Comes Love (Hot Water  California #1),Christie Ridgway,eng,384,01/01/2002
11106,Eat Right 4 Your Type,Peter J. D'Adamo/Catherine Whitney,eng,375,04/02/1998
11119,The Annotated Gulliver's Travels,Jonathan Swift/Isaac Asimov,eng,298,10/29/1980
11121,Gulliver's Travels,Jonathan Swift/Robert A. Greenberg,eng,432,03/01/1980
11130,The Chronicles of Narnia CD Box Set,C.S. Lewis/Kenneth Branagh,eng,31,10/26/2004
11136,The Chronicles of Narnia (The Chronicles of Narnia  #1-7),C.S. Lewis/Pauline Baynes,eng,766,10/15/2005
11137,Mere Christianity,C.S. Lewis/Kathleen Norris,eng,227,4/21/2015
11138,Mere Christianity,C.S. Lewis,eng,191,06/01/1996
11149,The Screwtape Letters,C.S. Lewis,eng,224,03/06/2001
11154,The Screwtape Letters/Book & Study Guide,C.S. Lewis,eng,172,01/01/1976
11157,Four Mothers,Shifra Horn/Dalya Bilu,eng,276,06/10/2000
11159,Four Mothers at Chautuaqua,Pansy/Isabella MacDonald Alden,eng,265,4/30/1997
11161,The Trial of God: (as it was held on February 25  1649  in Shamgorod),Elie Wiesel/Robert McAfee Brown/Matthew Fox,eng,208,11/14/1995
11162,Summer for the Gods: The Scopes Trial and America's Continuing Debate Over Science and Religion,Edward J. Larson/Brian Troxell,eng,318,11/15/1998
11166,Dawn (The Night Trilogy  #2),Elie Wiesel/Frances Frenaye,eng,81,3/21/2006
11167,The Forgotten,Elie Wiesel/Stephen Becker,eng,320,1/31/1995
11168,Day (The Night Trilogy  #3),Elie Wiesel/Anne Borchardt,eng,109,3/21/2006
