bookID,title,authors,language_code,num_pages,publication_date
32213,Expectant Father,Melinda Curtis,eng,304,12/15/2011
32226,Horse Heaven,Jane Smiley,eng,640,8/26/2003
32234,White Oleander,Janet Fitch,eng,446,09/01/2001
32241,The Night Remembers (Night  #1),Kathleen Eagle,eng,355,06/01/1998
32254,The Mephisto Club (Rizzoli & Isles  #6),Tess Gerritsen,eng,355,09/12/2006
32255,Vanish (Rizzoli & Isles  #5),Tess Gerritsen,eng,401,8/29/2006
32256,Call After Midnight & Under The Knife,Tess Gerritsen,eng,555,4/25/2006
32257,The Sinner (Rizzoli & Isles  #3),Tess Gerritsen,eng,419,1/17/2005
32258,Body Double (Rizzoli & Isles  #4),Tess Gerritsen,eng,432,7/26/2005
32262,Life Support,Tess Gerritsen,eng,400,08/01/1998
32264,The Family that Couldn't Sleep,D.T. Max,eng,299,09/05/2006
32275,River Out of Eden: A Darwinian View of Life,Richard Dawkins/Lalla Ward,eng,172,8/23/1996
32276,Dragons of Eden: Speculations on the Evolution of Human Intelligence,Carl Sagan,eng,271,12/12/1986
32277,Eden: It's an Endless World  Volume 1 (Eden: It's an Endless World  #1),Hiroki Endo,eng,216,11/15/2005
32281,Demonic Males: Apes and the Origins of Human Violence,Richard W. Wrangham/Dale Peterson,eng,368,11/14/1997
32286,A Mad People's History of Madness,Dale Peterson,eng,384,3/15/1982
32289,A Primate's Memoir: A Neuroscientist's Unconventional Life Among the Baboons,Robert M. Sapolsky,eng,304,03/12/2002
32295,Blame It on the Brain: Distinguishing Chemical Imbalances  Brain Disorders  and Disobedience,Edward T. Welch,eng,204,06/01/1998
32298,Blame!  Vol. 7,Tsutomu Nihei,eng,210,02/01/2007
32300,The Berenstain Bears and the Blame Game,Stan Berenstain/Jan Berenstain,eng,32,10/07/1997
32302,Blame!  Vol. 8,Tsutomu Nihei,eng,216,05/01/2007
32303,The New Don't Blame Mother: Mending the Mother-Daughter Relationship,Paula J. Caplan,eng,320,3/25/2000
32307,Blame It on Paris,Laura Florand,eng,384,10/03/2006
32313,No Wind of Blame (Inspector Hemingway #1),Georgette Heyer,eng,352,09/07/2006
32316,Uncle John's Presents Blame It on the Weather: Amazing Weather Facts,David W. Phillips/Michael Parfit/Suzanne Chisholm/Bathroom Readers' Institute,eng,240,11/01/2002
32317,Who's To Blame (Sweet Valley High  #66),Francine Pascal/Kate William,eng,152,06/01/1990
32323,Blame! #1,Tsutomu Nihei,fre,245,3/20/2000
32328,Air Gear  Vol. 2 (Air Gear  #2),Oh! Great/大暮 維人,eng,224,10/31/2006
32329,Air Gear  Vol. 3 (Air Gear  #3),Oh! Great/大暮 維人,eng,224,1/30/2007
32330,Air Gear  Vol. 1 (Air Gear  #1),Oh! Great/大暮 維人,eng,224,7/25/2006
32331,Air Gear  Vol. 4 (Air Gear  #4),Oh! Great/大暮 維人,en-GB,224,05/01/2007
32338,Fire in the Minds of Men: Origins of the Revolutionary Faith,James H. Billington,eng,677,01/01/1980
32349,Mutant Message Down Under,Marlo Morgan,eng,187,5/25/2004
32350,Mutants & Masterminds: RPG,Steve Kenson/Ramón Pérez,eng,253,11/01/2005
32351,Mutants: On Genetic Variety and the Human Body,Armand Marie Leroi,eng,448,1/25/2005
32353,The New Mutants Classic  Vol. 1,Chris Claremont/Bob McLeod,eng,240,05/03/2006
32358,James Dean: The Mutant King: A Biography,David Dalton,eng,384,09/01/2001
32370,Dry,Augusten Burroughs,eng,293,04/01/2004
32373,Yes  Your Teen Is Crazy!: Loving Your Kid Without Losing Your Mind,Michael J. Bradley,eng,332,11/08/2002
32386,El Retrato De Dorian Gray,Oscar Wilde,spa,251,04/07/2006
32396,Henry IV  Part 1,William Shakespeare/Barbara A. Mowat/Paul Werstine,eng,336,01/01/2005
32398,Henry IV  Part 2,William Shakespeare/Barbara A. Mowat/Paul Werstine,eng,400,01/01/2006
32400,Henry IV  part II,William Shakespeare,eng,336,4/26/2005
32401,King Henry IV  Part 2,William Shakespeare/Arthur Raleigh Humphreys,eng,336,10/12/1967
32408,Piccole donne,Louisa May Alcott/Jame's Prunier/Laura Cangemi,ita,288,4/15/2001
32410,I Henry IV,William Shakespeare/Gordon McMullan,eng,432,4/22/2003
32413,Collected Plays: Henry IV  The Man with the Flower in His Mouth  Right You Are,Luigi Pirandello/Henry Reed,eng,236,07/01/1987
32414,Henry IV  Parts I & II,William Shakespeare/Ronald K. Levao,eng,400,12/01/2006
32417,Black Sunday,Thomas  Harris,eng,311,11/01/2005
32418,Hannibal (Hannibal Lecter  #3),Thomas  Harris,eng,564,5/18/2000
32419,The Hannibal Lecter Trilogy,Thomas  Harris,eng,1222,11/03/2005
32421,Velocity,Dean Koontz,eng,460,4/25/2006
32422,Hideaway,Dean Koontz,eng,413,07/05/2005
32424,Lightning,Dean Koontz,eng,384,09/02/2003
32426,Icebound,David Axton/Dean Koontz,eng,408,09/05/2000
32427,The Servants of Twilight / Darkfall / Phantoms,Dean Koontz/Leigh Nichols,eng,752,7/27/1991
32428,Shadow Fires,Leigh Nichols/Dean Koontz,eng,528,06/01/1993
32430,The Bad Place,Dean R. Koontz,eng,417,07/06/2004
32432,Fear Nothing (Moonlight Bay  #1),Dean Koontz,eng,448,12/01/1998
32433,The Key to Midnight,Dean Koontz/Leigh Nichols,eng,419,06/01/1995
32434,Mr. Murder,Dean Koontz,eng,493,07/05/2006
32435,Phantoms,Dean Koontz,eng,448,02/05/2002
32437,The Face,Dean Koontz,eng,649,4/27/2004
32438,Shattered,Dean Koontz,eng,289,2/15/1985
32439,Intensity,Dean Koontz,eng,436,10/31/2000
32441,The Good Guy,Dean Koontz,eng,386,5/29/2007
32443,The Eyes of Darkness,Leigh Nichols/Dean Koontz,eng,366,07/01/1996
32446,The Door to December,Richard Paige/Dean Koontz,eng,518,06/01/2002
32453,The Servants of Twilight,Leigh Nichols/Dean Koontz,eng,499,5/16/1991
32456,Darkfall,Dean Koontz,eng,371,02/06/2007
32461,Ghosts and Grisly Things,Ramsey Campbell/Jack Dann/Dennis Etchison,eng,300,10/11/2001
32483,Shakespeare: The Biography,Peter Ackroyd,eng,608,11/14/2006
32484,The Necessary Shakespeare,William Shakespeare,eng,896,8/27/2004
32487,Shakespeare After All,Marjorie Garber,eng,1008,9/20/2005
32488,Playing Shakespeare: An Actor's Guide,John   Barton/Luann Walther,eng,288,8/21/2001
32498,John Grisham Value Collection: A Time to Kill  The Firm  The Client,John Grisham/Michael Beck/Blair Brown/D.W. Moffett,eng,0,06/01/2004
32499,The Pelican Brief,John Grisham,eng,400,4/25/2006
32500,The Harry Bosch Novels  Volume 1: The Black Echo / The Black Ice / The Concrete Blonde (Harry Bosch #1-3),Michael Connelly,eng,794,10/22/2001
32501,Echo Park (Harry Bosch  #12; Harry Bosch Universe  #16),Michael Connelly,eng,405,10/09/2006
32502,Angels Flight (Harry Bosch  #6; Harry Bosch Universe  #7),Michael Connelly,eng,454,01/05/2000
32503,The Harry Bosch Novels  Volume 2: The Last Coyote / Trunk Music / Angels Flight (Harry Bosch  #4-6),Michael Connelly,eng,821,11/03/2003
32505,The Closers (Harry Bosch  #11; Harry Bosch Universe  #14),Michael Connelly,eng,432,10/02/2006
32506,The Poet (Jack McEvoy  #1; Harry Bosch Universe  #5),Michael Connelly,eng,510,07/01/2002
32507,Chasing the Dime,Michael Connelly,eng,448,09/01/2003
32508,The Black Echo (Harry Bosch  #1; Harry Bosch Universe  #1),Michael Connelly,eng,482,12/01/2002
32509,Tales From Shakespeare,Charles Lamb/Mary Lamb/Arthur Rackham,eng,278,08/05/1994
32510,Shakespeare's Champion (Lily Bard  #2),Charlaine Harris,eng,214,12/05/2006
32511,Will in the World: How Shakespeare Became Shakespeare,Stephen Greenblatt,eng,430,9/30/2004
32514,Sonnets,William Shakespeare/Barbara A. Mowat/Paul Werstine,eng,391,02/01/2004
32516,Shakespeare's Trollop (Lily Bard  #4),Charlaine Harris,eng,194,05/04/2004
32517,Shakespeare's Kitchen: Renaissance Recipes for the Contemporary Cook,Francine Segan/Tim Turner/Patrick O'Connell,eng,288,10/14/2003
32520,Sonnets,William Shakespeare/Stephen  Booth,eng,583,07/11/2000
32522,The Art of Shakespeare's Sonnets,Helen Vendler,eng,692,11/01/1999
32523,Hide (Detective D.D. Warren  #2),Lisa Gardner,eng,375,1/30/2007
32527,Alone (Detective D.D. Warren  #1),Lisa Gardner/Anna Fields,eng,451,12/27/2005
32530,The Third Victim (Quincy & Rainie  #2),Lisa Gardner,eng,384,1/30/2001
32532,On Becoming a Novelist,John Gardner/Raymond Carver,eng,150,10/17/1999
32533,The Art of Fiction: Notes on Craft for Young Writers,John Gardner,eng,224,06/04/1991
32534,October Light,John Gardner/Tom Bissell,eng,399,10/17/2005
32537,Excellence,John W. Gardner,eng,176,4/17/1995
32540,Conversations with Bernard Malamud (Literary Conversations),J. Michael Lennon/Lawrence M. Lasher,eng,156,4/28/1991
32552,Essential Tales and Poems,Edgar Allan Poe/Benjamin F. Fisher,eng,688,10/25/2004
32558,Poetry  Tales and Selected Essays,Edgar Allan Poe/Gary Richard Thompson/G.R. Thompson/Patrick F. Quinn,eng,1520,10/01/1996
32560,The Complete Stories,Franz Kafka/Nahum N. Glatzer/John Updike,eng,488,11/14/1995
32561,The Sons,Franz Kafka/Edwin Muir/Willa Muir/Eithne Wilkins/Ernst Kaiser/Mark Anderson/Arthur S. Wensinger,eng,167,08/05/1989
32572,The Metamorphosis and Other Stories,Franz Kafka/Donna Freed/Jason Baker,eng,191,9/20/2004
32574,The Metamorphosis And Other Stories,Franz Kafka/Joachim Neugroschel,eng,227,12/01/1993
32576,Metamorphosis (Star Trek: The Next Generation),Jean Lorrah,eng,371,03/01/1990
32578,Lolita,Richard Corliss,eng,96,12/27/1994
32579,Lolita: The Screenplay,Vladimir Nabokov,eng,240,8/26/1997
32581,Lolita,Vladimir Nabokov/Martin Amis,eng,335,03/09/1993
32584,Mysteries,Knut Hamsun/Sverre Lyngstad,eng,313,01/01/2001
32585,Hunger,Knut Hamsun/George Egerton,eng,134,11/17/2003
32588,Victoria,Knut Hamsun/Oliver Stallybrass,eng,155,10/01/1994
32589,The Wanderer,Knut Hamsun/Oliver Stallybrass/Gunnvor Stallybrass,eng,164,4/30/2001
32590,Pan,Knut Hamsun/Sverre Lyngstad,eng,181,09/01/1998
32591,The Last Joy,Knut Hamsun/Sverre Lyngstad,eng,250,07/01/2002
32592,In Wonderland,Knut Hamsun/Sverre Lyngstad,nor,185,09/01/2003
32609,Guilty as Charged,Scott Turow/Sarah Shankman/Jay Brandon/Jeremiah Healy/Ed Gorman/John Jakes/Maynard F. Thomson/Lia Matera/Susan Dunlap/Bill Pronzini/John Lutz/Andrew Klavan/Marcia Muller/Stuart M. Kaminsky/Carolyn Wheat/Stan Washburn/Valerie Frankel,eng,10,10/01/1996
32610,On the Shoulders of Giants: The Great Works of Physics and Astronomy,Stephen Hawking/Isaac Newton/Nicolaus Copernicus/Albert Einstein/Johannes Kepler/Galileo Galilei,eng,256,01/01/2006
32625,Visions of Heaven and Hell,Clive Barker,eng,352,9/27/2005
32626,Books of Blood: Volumes One to Three (Books of Blood #1-3),Clive Barker,eng,507,10/01/1998
32627,Everville (Book of the Art #2),Clive Barker,eng,697,11/03/1999
32628,The Great and Secret Show (Book of the Art #1),Clive Barker,eng,658,11/03/1999
32636,Abarat: Days of Magic  Nights of War,Clive Barker,eng,569,9/26/2006
32637,Imajica: The Reconciliation,Clive Barker,eng,544,05/10/1995
32639,Sacrament,Clive Barker,eng,594,05/01/1997
32640,The Inhuman Condition (Books of Blood  #4),Clive Barker,eng,180,03/01/2001
32649,Notebook of a Return to the Native Land,Aimé Césaire/Annette Smith/Clayton Eshleman,eng,66,9/24/2001
32650,The Return of the Native,Thomas Hardy/Alexander Theroux,eng,448,2/13/2001
32656,The Return of the Native,Thomas Hardy/Phillip Mallett,eng,552,2/14/2006
32664,The Stephen King Collection: Stories from Night Shift,Stephen King/John  Glover,eng,9,05/02/2000
32667,Blood and Smoke,Stephen King,eng,4,01/01/2000
32668,LT's Theory of Pets,Stephen King,eng,1,08/01/2001
32679,Carretera maldita,Richard Bachman/Stephen King/Joseph M. Apfelbäume,spa,362,02/01/1999
32680,Silver Bullet,Stephen King/Bernie Wrightson,eng,255,11/12/1985
32682,Patriot Games (Jack Ryan  #1),Tom Clancy,eng,503,05/01/1992
32686,Legends,Robert Silverberg/Stephen King/Robert Jordan/Terry Goodkind/Anne McCaffrey/Orson Scott Card/Tad Williams/George R.R. Martin/Raymond E. Feist/Terry Pratchett/Ursula K. Le Guin,eng,717,09/08/2001
32689,Bare Bones: Conversations on Terror with Stephen King,Tim Underwood/Chuck Miller/Stephen King,eng,224,07/01/1989
32691,Four Past Midnight,Stephen King,eng,768,03/02/2004
32692,Gerald's Game,Stephen King,eng,332,09/01/1992
32694,Faithful: Two Diehard Boston Red Sox Fans Chronicle the Historic 2004 Season,Stewart O'Nan/Stephen King,eng,445,09/06/2005
32695,El talismán,Stephen King/Peter Straub/Pilar Giralt Gorina,spa,375,07/01/2003
32696,El umbral de la noche,Stephen King/Gregorio Vlastelica/Eduardo Goligorsky,spa,417,4/30/2004
32702,Rabia,Richard Bachman/Stephen King/Hernán Sabaté Vargas,spa,203,09/01/1987
32703,The Diary of Ellen Rimbauer: My Life at Rose Red,Joyce Reardon/Steven Rimbauer/Ridley Pearson,eng,277,4/29/2001
32709,Now and on Earth,Jim Thompson/Stephen King,eng,320,02/01/1994
32714,The Monkey,Stephen King/David Purdham,eng,2,10/28/1989
32715,Desperation / The Regulators: Box Set,Stephen King/Richard Bachman,eng,1075,10/01/1996
32720,Ojos de fuego,Stephen King/Eduardo Goligorsky,spa,528,09/04/2001
32737,Tevye's Daughters: Collected Stories of Sholom Aleichem,Sholom Aleichem/Frances Butwin,eng,302,11/01/1999
32741,Favorite Tales of Sholom Aleichem,Sholom Aleichem/Ben Shahn/Frances Butwin/Julius Butwin,eng,692,11/18/1990
32750,Brown Girl  Brownstones,Paule Marshall/Mary Helen Washington/Edwidge Danticat,eng,324,08/01/2006
32760,V.,Thomas Pynchon,ger,544,08/01/1994
32765,Gimpel the Fool: And Other Stories,Isaac Bashevis Singer/Saul Bellow,eng,205,12/31/1988
32767,At the Mountains of Madness,H.P. Lovecraft/China Miéville/S.T. Joshi,eng,224,6/14/2005
32768,At the Mountains of Madness and Other Novels,H.P. Lovecraft/James Turner/S.T. Joshi/August Derleth,eng,458,12/01/1985
32769,At the Mountains of Madness and Other Tales of Terror,H.P. Lovecraft,eng,184,9/13/1991
32773,Mountain Madness (Wilderness  #24),David   Robbins/David Thompson,eng,170,06/01/1998
32774,At the Mountains of Madness and Other Novels of Terror,H.P. Lovecraft/August Derleth/E. Hoffmann Price,eng,552,6/17/2002
32778,The Aeneid,Virgil/Robert Fitzgerald,eng,483,6/30/1992
32779,The Aeneid (Verse Translation),Virgil/Rolfe Humphries,eng,368,1/15/1987
32780,The Iliad,Homer/Andrew Lang,eng,542,09/01/2011
32781,War and the Iliad,Simone Weil/Rachel Bespaloff/Mary McCarthy/Christopher E.G. Benfey/Hermann Broch,eng,121,3/31/2005
32782,The Iliad,Homer/Victor G. Ambrus/Nick McCarty,eng,95,9/15/2000
32807,Trojan Odyssey (Dirk Pitt  #17),Clive Cussler,eng,463,12/01/2004
32810,The Divine Comedy II: Purgatory,Dante Alighieri/Dorothy L. Sayers/C.W. Scott-Giles,eng,388,8/30/1981
32811,The Divine Comedy,Dante Alighieri/C.H. Sisson/David H. Higgins,eng,735,6/18/1998
32812,Paradiso (The Divine Comedy  #3),Dante Alighieri/Dorothy L. Sayers/Barbara Reynolds,eng,400,7/30/1962
32813,Modern Reader's Guide to Dante's the Divine Comedy,Joseph Gallagher,eng,256,05/10/1999
32814,The Canterbury Tales,Geoffrey Chaucer/Nevill Coghill,eng,489,7/30/1970
32816,The Canterbury Tales: Fifteen Tales and the General Prologue,Geoffrey Chaucer/V.A. Kolve/Glending Olson,enm,600,08/01/2005
32823,Fanning the Flame: Bible  Cross  and Mission,Chris    Green/Chris Wright/Paul Douglas Gardner,eng,336,6/17/2003
32827,From the Earth to the Moon (Extraordinary Voyages  #4),Jules Verne,eng,136,10/01/2006
32828,The Mammoth Book of New Jules Verne Adventures: Return to the Center of the Earth and Other Extraordinary Voyages  New Tales by the Heirs of Jules Verne,Mike Ashley/Eric Brown/Keith Brooke/Johan Heliot/Kevin J. Anderson/Sarah A. Hoyt/Justina Robson/Adam Roberts/Paul Di Filippo/Tim Lebbon/Molly Brown/Tony Ballantyne/Stephen Baxter/Richard A. Lupoff/Sharan Newman/Michael Pagel/Liz Williams/Brian Stableford/James Lovegrove/Ian Watson/Peter Criwther/Laurent Genefirt/F. Gwynplaine MacIntyre/Michael Mallory,eng,498,2/15/2005
32829,Journey to the Center of the Earth (Extraordinary Voyages  #3),Jules Verne,eng,240,4/25/2006
32830,20 000 Leagues Under The Sea,Pauline Francis/Jules Verne,eng,48,08/01/2004
32831,The Mysterious Island (Extraordinary Voyages  #12),Jules Verne/Caleb Carr/Jordan Stump,eng,723,4/27/2004
32832,The Lighthouse at the End of the World,Jules Verne,eng,260,3/20/2001
32833,The World of Jules Verne,Gonzague Saint Bris/Arthur C. Clarke/Stéphane Heuet/Helen Marx/Saint-Bris Gonzague,eng,85,11/01/2006
32835,The End of Nana Sahib: The Steam House (Extraordinary Voyages  #20),Jules Verne/Agnes D. Kingston,eng,276,7/19/2003
32836,Around the World in Eighty Days,Jules Verne/Herbert R. Lottman/Jacqueline Rogers,eng,236,06/07/2005
32843,Around the World in Eighty Days,Jules Verne/George M. Towle/Bruce Sterling,eng,211,12/30/2003
32844,The Mysterious Island,Jules Verne/Jordan Stump/Caleb Carr,eng,630,12/10/2002
32849,Adrift in the Pacific: Two Years Holiday (Extraordinary Voyages  #32),Jules Verne,eng,300,4/24/2003
32854,Final Payments,Mary Gordon,eng,304,06/06/2006
32872,Sliver of Truth (Ridley Jones #2),Lisa Unger,eng,308,01/02/2007
32880,The Mothman Prophecies,John A. Keel,eng,352,03/07/2002
32884,Intimate Communion: Awakening Your Sexual Essence,David Deida/Lorrie Bortner,eng,270,11/01/1995
32893,Letter to a Man in the Fire: Does God Exist and Does He Care?,Reynolds Price,eng,112,10/17/2000
32899,The Promise of Rest,Reynolds Price/Mary Bess Engel,eng,368,11/05/1996
32900,Perfect Match,Jodi Picoult,eng,368,05/01/2002
32913,Demon Box,Ken Kesey,eng,400,08/04/1987
32915,Sailor Song,Ken Kesey,eng,533,07/01/1993
32916,On the Bus: The Complete Guide to the Legendary Trip of Ken Kesey and the Merry Pranksters and the Birth of Counterculture,Paul Perry/Ken Babbs,eng,205,01/07/1997
32919,The Further Inquiry,Ken Kesey/Ron Bevirt,eng,215,10/01/1990
32929,Goodnight Moon,Margaret Wise Brown/Clement Hurd,eng,32,1/23/2007
32936,Goodnight Moon 123: A Counting Book (Over the Moon),Margaret Wise Brown/Clement Hurd,eng,32,07/01/2007
32939,New Rules: Polite Musings from a Timid Observer,Bill Maher,eng,304,7/26/2005
32941,True Story,Bill Maher,eng,304,10/01/2005
32942,Does Anybody Have a Problem With That? The Best of Politically Incorrect,Bill Maher,eng,288,5/20/1997
32946,The Outsiders,S.E. Hinton,eng,218,03/06/2003
32947,Outsiders Within: Writing on Transracial Adoption,Jane Jeong Trenka/Julia Chinyere Oparah,eng,300,08/01/2006
32950,Outsiders  Vol. 5: The Good Fight,Judd Winick/Matthew Clark/Art Thibert/Pop Mhan/Ron Randall,eng,192,01/03/2007
32951,Sister Outsider: Essays and Speeches,Audre Lorde,en-GB,190,06/01/1984
32957,Caramelo,Sandra Cisneros,eng,441,09/09/2003
32961,The House on Mango Street,Sandra Cisneros,eng,2,8/30/2005
32964,Selections from Homer’s Iliad,Homer/Allen Rogers Benner/Mark W. Edwards,eng,522,12/15/2001
32966,The Merchant of Venice,William Shakespeare,eng,240,04/07/2005
32975,Nancy Drew: Girl Detective: #1-4,Carolyn Keene,eng,640,10/01/2004
32977,Nancy's Mysterious Letter (Nancy Drew Mystery Stories  #8),Carolyn Keene/Walter Karig,eng,210,04/01/1996
32979,The Secret of the Old Clock (Nancy Drew Mystery Stories  #1),Carolyn Keene/Russell H. Tandy/Sara Paretsky,eng,210,09/01/1991
32980,The Mystery at the Moss-covered Mansion (Nancy Drew Mystery Stories  #18),Carolyn Keene/Russell H. Tandy/Mildred Benson,eng,215,02/01/2003
32981,The Mystery of the Brass-Bound Trunk (Nancy Drew Mystery Stories  #17),Carolyn Keene/Mildred Benson,eng,228,12/01/2001
32986,The Mantle of the Prophet: Religion and Politics in Iran,Roy Mottahedeh,eng,416,8/15/2000
32987,The Greatest Generation,Tom Brokaw,eng,464,05/01/2001
32994,Maverick: The Success Story Behind the World's Most Unusual Workplace,Ricardo Semler,eng,336,09/06/2001
33001,Weekend Warriors (Sisterhood  #1),Fern Michaels,eng,304,07/01/2004
33002,The Weekend Novelist,Robert J. Ray/Bret Norris,eng,266,04/01/2005
33007,The Week-End Book,Francis Meynell/John Julius Norwich/Francis Maynell,eng,368,05/04/2006
33008,North Carolina Weekends,Lynn Setzer,eng,353,10/01/2003
33013,Far from the Madding Crowd,Thomas Hardy/Margaret Drabble,eng,465,12/11/2001
33015,Selected Poems,Thomas Hardy/Robert Mezey,eng,320,12/01/1998
33017,Selected Poetry,Thomas Hardy/Samuel Hynes,eng,304,05/06/1999
33024,Underworld (Underworld  #1),Greg Cox/Danny McBride/Len Wiseman/Kevin Grevioux,eng,384,8/26/2003
33025,Underworld: The Mysterious Origins of Civilization,Graham Hancock,eng,784,10/28/2003
33026,The Dream and the Underworld,James Hillman,eng,256,7/25/1979
33028,Underworld (Star Wars: The Last of the Jedi  #3),Jude Watson,eng,160,12/01/2005
33029,Star Wars: Underworld - The Yavin Vassilika,Mike Kennedy/Carlos Meglia,eng,120,10/16/2001
33030,Underworld: Blood Enemy (Underworld  #2),Greg Cox/Len Wiseman/Kevin Grevioux,eng,310,11/30/2004
33032,Queen of the Underworld,Gail Godwin,eng,368,1/30/2007
33046,Ve  perro ¡Ve!,P.D. Eastman/Adolfo Pérez Perdomo,spa,24,2/25/2003
33052,Murder in the Cathedral,T.S. Eliot,eng,148,3/18/1964
33057,Cathedral  Forge  and Waterwheel: Technology and Invention in the Middle Ages,Frances Gies/Joseph Gies,eng,368,01/01/1995
33064,L'Équilibre du monde,Rohinton Mistry/Françoise Adelstain,fre,890,6/20/2001
33075,In the Kitchen with Rosie: Oprah's Favorite Recipes,Rosie Daley/Oprah Winfrey,eng,142,4/16/1994
33130,King Richard II,William Shakespeare/Andrew Gurr,eng,252,05/05/2003
33131,King Richard II,William Shakespeare/Charles R. Forker,eng,593,3/21/2002
33133,King Richard II,William Shakespeare/Andrew Gurr,eng,240,11/30/1984
33137,Floating in My Mother's Palm,Ursula Hegi/John Collier/Francine Kass,eng,192,07/03/1998
33139,Tearing the Silence: On Being German in America,Ursula Hegi,eng,304,07/03/1998
33144,Paint it Black,Janet Fitch,eng,387,09/01/2006
33151,The Tempest,William Shakespeare/Peter Hulme/William H. Sherman,eng,355,12/23/2003
33152,The Day of the Tempest (Dragonlance: Dragons of a New Age  #2),Jean Rabe,eng,352,08/01/2002
33153,A Tempest,Aimé Césaire/Richard Miller,eng,69,05/01/2002
33155,A Midsummer Night's Dream,William Shakespeare/Harold F. Brooks,eng,312,09/06/1979
33157,A Midsummer Night's Dream (SparkNotes Literature Guide),SparkNotes/William Shakespeare,eng,64,01/10/2002
33158,A Midsummer Night's Dream,William Shakespeare/R.A. Foakes,eng,168,4/28/2003
33159,Minuit dans le jardin du bien et du mal,John Berendt,fre,388,06/06/1998
33169,Les Essais (mis en français moderne par Claude Pinganaud),Michel de Montaigne,fre,806,9/14/2002
33174,Cliffs Notes on Hugo's Les Miserables,Amy L. Marsland,en-GB,120,11/01/1968
33175,Les Misérables,Victor Hugo/Norman Denny,eng,1232,3/25/1982
33179,Hamlet in Purgatory,Stephen Greenblatt,eng,344,9/15/2002
33180,From Hinton to Hamlet: Building Bridges between Young Adult Literature and the Classics,Sarah K. Herz/Donald R. Gallo,eng,256,09/01/2005
33185,Hamlet,William Shakespeare/Burton Raffel/Harold Bloom,eng,249,09/10/2003
33186,Hamlet  Prince of Denmark,William Shakespeare/Philip Edwards/Robert Hapgood,eng,270,4/21/2003
33191,Romeo & Juliet,William Shakespeare/Roma Gill,eng,142,5/26/2005
33192,Romeo and Juliet,William Shakespeare/Paul D. Moliken,eng,111,03/01/2003
33194,Romeo and Juliet,William Shakespeare/G. Blakemore Evans/Thomas Moisan,eng,278,05/01/2003
33195,Shakespeare's Romeo and Juliet,William Shakespeare/Karin Jacobson/Sidney Lamb,eng,231,05/08/2000
33197,Romeo and Juliet (SparkNotes Literature Guide),SparkNotes/Brian  Phillips/William Shakespeare,eng,88,01/10/2002
33198,Romeo and Juliet,William Shakespeare/René Weis,eng,350,7/15/2012
33247,La Petite Fille du Lac,Christina Schwarz/Marie-Hélène Sabard,fre,363,03/06/2003
33263,South of the Border  West of the Sun,Haruki Murakami/Philip Gabriel,eng,213,3/14/2000
33279,Clock of the Long Now: Time and Responsibility: The Ideas Behind the World's Slowest Computer,Stewart Brand,eng,208,04/06/2000
33282,Jessica's Bad Idea (Sweet Valley Twins and Friends  #31),Francine Pascal/Jamie Suzanne,eng,104,08/01/1989
33288,How to Win Friends and Influence People,Dale Carnegie,eng,268,04/06/2006
33291,How to Win Friends and Influence People,Dale Carnegie,eng,256,3/31/1994
33292,How to Win Friends and Influence People for Teen Girls,Donna Dale Carnegie,eng,208,06/02/2005
33293,Naked Economics: Undressing the Dismal Science,Charles Wheelan,eng,288,9/17/2003
33295,The Naked Warrior: Master the Secrets of the Super-Strong - Using Bodyweight Exercises Only,Pavel Tsatsouline,eng,218,01/01/2010
33297,The Naked Ape: A Zoologist's Study of the Human Animal,Desmond Morris,eng,256,4/13/1999
33308,There's No Toilet Paper . . . on the Road Less Traveled: The Best of Travel Humor and Misadventure,Doug Lansky,eng,216,11/16/2005
33313,Kitchen Confidential: Adventures in the Culinary Underbelly,Anthony Bourdain,eng,312,01/09/2007
33331,More Than You Know: Finding Financial Wisdom in Unconventional Places,Michael J. Mauboussin,eng,268,4/21/2006
33333,Searching for God Knows What,Donald Miller,eng,246,10/11/2004
33342,The More Than Complete Hitchhiker's Guide (Hitchhiker's Guide  #1-4 + short story),Douglas Adams,eng,624,11/01/1989
33344,Hitchhiker's Guide To The Galaxy: The Filming of the Douglas Adams classic,Robbie Stamp/Paul Simpson,eng,184,4/22/2005
33348,Different Seasons,Stephen King,en-GB,560,10/01/1983
33353,It's Called a Breakup Because It's Broken: The Smart Girl's Break-Up Buddy,Greg Behrendt/Amiira Ruotola (-Behrendt),eng,276,09/05/2006
33356,Jennifer Government,Max Barry,eng,352,02/05/2004
33363,Mama Day,Gloria Naylor,eng,312,4/23/1989
33365,A Feather on the Breath of God,Sigrid Nunez,eng,192,12/27/2005
33367,Mitz The Marmoset of Bloomsbury,Sigrid Nunez,eng,128,2/15/2007
33411,War with the Newts,Karel Čapek/M. Weatherall/R. Weatherall/Ivan Klíma,eng,348,10/07/1996
33418,Parallel Worlds: A Journey through Creation  Higher Dimensions  and the Future of the Cosmos,Michio Kaku,eng,361,2/14/2006
33436,Key Lime Pie Murder (Hannah Swensen  #9),Joanne Fluke,eng,342,7/31/2007
33437,Cherry Cheesecake Murder (Hannah Swensen  #8),Joanne Fluke,eng,382,02/01/2007
33438,Peach Cobbler Murder (Hannah Swensen  #7),Joanne Fluke,eng,384,02/01/2006
33439,Strawberry Shortcake Murder (Hannah Swensen  #2),Joanne Fluke,eng,320,02/02/2002
33440,Lemon Meringue Pie Murder (Hannah Swensen  #4),Joanne Fluke,eng,352,02/01/2004
33441,Fluke: Or  I Know Why the Winged Whale Sings,Christopher Moore,eng,321,6/15/2004
33442,Sugar Cookie Murder (Hannah Swensen  #6),Joanne Fluke,eng,380,10/01/2005
33443,Chocolate Chip Cookie Murder (Hannah Swensen  #1),Joanne Fluke,eng,436,09/01/2006
33445,Blueberry Muffin Murder (Hannah Swensen  #3),Joanne Fluke,eng,310,02/01/2003
