bookID,title,authors,language_code,num_pages,publication_date
19792,Power: Die 48 Gesetze Der Macht,Robert Greene/Birgit Brandau/Hartmut Schickert,ger,536,10/01/2001
19794,The Echo Maker,Richard Powers,eng,451,10/17/2006
19795,Power vs. Force,David R. Hawkins,eng,341,03/05/2002
19797,The Power of Art,Simon Schama,eng,448,11/10/2006
19801,Goodbye  Darkness: A Memoir of the Pacific War,William Manchester,eng,401,04/12/2002
19802,A World Lit Only by Fire: The Medieval Mind and the Renaissance: Portrait of an Age,William Manchester,eng,322,06/01/1993
19803,The Last Lion 2: Winston Spencer Churchill: Alone  1932-40,William Manchester,eng,756,10/28/1988
19807,The Glory and the Dream: A Narrative History of America 1932-72,William Manchester,eng,1397,07/01/1984
19808,The Last Lion: Winston Spencer Churchill: Visions of Glory  1874-1932,William Manchester,eng,992,5/30/1983
19809,The Last Lion: Winston Spencer Churchill: Visions of Glory 1874-1932,William Manchester,eng,992,04/01/1984
19818,Moon-Flash (Kyreol  #1-2),Patricia A. McKillip,eng,304,3/17/2005
19819,Harrowing the Dragon,Patricia A. McKillip,eng,308,11/07/2006
19820,Cygnet (Cygnet  #1-2),Patricia A. McKillip,eng,406,03/06/2007
19822,Solstice Wood (Winter Rose  #2),Patricia A. McKillip,eng,278,01/02/2007
19823,Od Magic,Patricia A. McKillip,eng,315,06/06/2006
19844,25 Ways to Win with People: How to Make Others Feel Like a Million Bucks,John C. Maxwell/Les Parrott III,eng,208,06/05/2005
19847,Winning with People Workbook,John C. Maxwell,eng,256,09/10/2005
19858,Thornhold (The Harpers  #16; Songs & Swords  #4),Elaine Cunningham,eng,384,12/27/2011
19859,The Best of the Realms: The Stories of Elaine Cunningham (Forgotten Realms: The Best of the Realms  #3),Elaine Cunningham,en-GB,345,05/08/2007
19885,Changeling Storytellers Guide,Mark  Hunter/Ian Lemke,eng,139,08/01/1998
19888,The Blood Wood (Earthdawn 6113),FASA Corporation/Ian Lemke/Louis J. Prosperi,eng,152,06/01/1997
19894,Basin and Range,John McPhee,eng,240,04/01/1982
19897,The Deltoid Pumpkin Seed,John McPhee,eng,192,09/01/1992
19898,Assembling California,John McPhee,eng,294,02/01/1994
19903,Qué Se Puede Esperar Cuando Se Está Esperando,Heidi Murkoff/Arlene Eisenberg,spa,624,1/31/2006
19908,Master of Swords (Mageverse #4),Angela Knight,eng,294,10/03/2006
19909,Master of the Night (Mageverse #1),Angela Knight,eng,296,10/05/2004
19910,Master of Wolves (Mageverse  #3),Angela Knight,eng,294,04/04/2006
19911,Captive Dreams,Angela Knight/Diane Whiteside,eng,336,09/05/2006
19912,Master of Dragons (Mageverse #5),Angela Knight,eng,293,06/05/2007
19913,Master of the Moon (Mageverse #2),Angela Knight,eng,336,05/03/2005
19914,Jane's Warlord (Warlord #1),Angela Knight,eng,320,06/01/2004
19916,Over The Moon (Mageverse #3.5),Angela Knight/MaryJanice Davidson/Virginia Kantra/Sunny,eng,330,01/02/2007
19949,Mr. and Mistress (Dynasties: The Elliotts #5),Heidi Betts,eng,185,05/09/2006
19961,Artesia Volume 1,Mark Smylie,eng,192,9/20/2011
19981,Law of Enclosures,Dale Peck,eng,320,02/01/1997
19983,The Drift House: The First Voyage,Dale Peck,eng,437,11/01/2006
19997,Through a Brazen Mirror,Delia Sherman/Cortney Skinner/Ellen Kushner,eng,100,2/25/2015
19998,The Porcelain Dove,Delia Sherman,eng,416,07/01/1994
20001,Interfictions: An Anthology of Interstitial Writing,Delia Sherman/Theodora Goss/K. Tempest Bradford/Karen Jordan Allen/Rachel Pollack/Veronica Schanoes/Mikal Trimm/Colin Greenland/Vandana Singh/Matthew Cheney/Léa Silhol/Adrián Ferrero/Holly Phillips/Catherynne M. Valente/Christopher Barzak/Leslie What/Anna Tambour/Joy Marchand/Jon Singer/Csilla Kleinheincz/Michael J. DeLuca,eng,291,04/01/2007
20002,The Fall of the Kings (Riverside  #3),Ellen Kushner/Delia Sherman,eng,510,9/30/2003
20019,Killing Time,Cynthia Harrod-Eagles,eng,280,02/01/1999
20021,The Tangled Thread (Morland Dynasty  #10),Cynthia Harrod-Eagles,eng,474,09/01/1987
20022,The Flood-Tide (Morland Dynasty  #9),Cynthia Harrod-Eagles,eng,428,02/01/1986
20023,The White Road (Morland Dynasty  #28),Cynthia Harrod-Eagles,eng,480,11/01/2006
20024,The Maiden (The Morland Dynasty  #8),Cynthia Harrod-Eagles,eng,413,02/01/1985
20025,The Oak Apple (Morland Dynasty  #4),Cynthia Harrod-Eagles,eng,403,05/01/2001
20026,The Emperor (The Morland Dynasty  #11),Cynthia Harrod-Eagles,eng,512,08/01/1988
20051,The Nature of the Child,Jerome Kagan,eng,352,5/13/1994
20059,Confessions of a Pagan Nun,Kate Horsley,eng,191,09/10/2002
20071,Westminster Abby,Micol Ostow,eng,192,05/05/2005
20074,Changelings,Anne McCaffrey/Elizabeth Ann Scarborough,eng,320,12/26/2006
20075,Dragon's Fire (Pern  #19),Anne McCaffrey/Todd McCaffrey,eng,366,08/01/2006
20076,Maelstrom,Anne McCaffrey/Elizabeth Ann Scarborough,eng,237,1/31/2007
20086,The Mark of the Crown (Star Wars: Jedi Apprentice  #4),Jude Watson,eng,131,10/01/1999
20097,The Sea,John Banville/John      Lee,eng,0,8/15/2006
20117,Joy Within,Joan Goldstein/Manuela Soares,eng,144,11/15/1990
20118,Butch/Femme,Manuela Soares/Judy Grahn/Nisa Donnelly,eng,64,04/04/1996
20126,Expository Writing: Mini-Lessons * Strategies * Activities,Tara McCarthy/Drew Hires/Jaime Lucero/Vincent Ceci,eng,88,04/01/1998
20127,Persuasive Writing: Mini-Lessons  Strategies  Activities,Tara MacCarthy/Drew Hires,eng,64,08/01/1998
20157,McDougal Littell Science: Student Edition Grade 6 Earth Science 2006,McDougal Littell/Douglas W. Carnine,eng,972,04/12/2005
20164,Daisy Bates: Civil Rights Crusader from Arkansas,Grif Stockley,eng,340,10/18/2005
20174,The Loftier Way: Tales from the Ancient American Frontier,Blaine M. Yorgason/Brenton G. Yorgason,eng,131,12/28/1985
20179,A Higher Justice (The Trials of Kit Shannon #5),James Scott Bell,eng,303,09/01/2003
20181,Plot & Structure: Techniques and Exercises for Crafting a Plot That Grips Readers from Start to Finish,James Scott Bell,eng,234,10/06/2004
20182,Deadlock,James Scott Bell,eng,319,10/06/2002
20183,Breach of Promise,James Scott Bell,eng,345,2/15/2004
20219,Keats's Poetry and Prose,John Keats/Jeffrey N. Cox,eng,673,08/01/2008
20233,A False Mirror (Inspector Ian Rutledge  #9),Charles Todd,eng,384,01/09/2007
20234,Wings of Fire (Inspector Ian Rutledge  #2),Charles Todd,eng,323,5/15/1999
20235,A Cold Treachery (Inspector Ian Rutledge  #7),Charles Todd,eng,416,8/30/2005
20236,The Murder Stone,Charles Todd,eng,416,8/31/2004
20237,Legacy of the Dead (Inspector Ian Rutledge  #4),Charles Todd,eng,356,06/01/2001
20238,A Fearsome Doubt (Inspector Ian Rutledge  #6),Charles Todd,eng,384,7/29/2003
20239,Watchers of Time (Inspector Ian Rutledge  #5),Charles Todd,eng,421,7/30/2002
20240,Search the Dark (Inspector Ian Rutledge  #3),Charles Todd,eng,310,5/15/2000
20241,Bill Bryson's African Diary,Bill Bryson,eng,63,12/02/2002
20249,Hunters of Dune (Dune Chronicles  #7),Brian Herbert/Kevin J. Anderson,eng,524,8/22/2006
20250,The Battle Of Corrin (Legends of Dune  #3),Brian Herbert/Kevin J. Anderson,eng,624,09/01/2004
20252,House Corrino (Prelude to Dune #3),Brian Herbert/Kevin J. Anderson,eng,667,8/27/2002
20253,House Harkonnen (Prelude to Dune #2),Brian Herbert/Kevin J. Anderson,eng,733,8/28/2001
20254,Doctor Who: The Inside Story,Gary Russell,eng,256,10/26/2006
20258,Doctor Who Short Trips: Repercussions,Gary Russell/Peter Anghelides/J. Shaun Lyon/Jon de Burgh Miller/Eddie Robson/Todd Green/Andy Russell/Andrew Collins/Kathryn Sullivan/Iain McLaughlin/Mark Michalowski/Joseph Lidster/Trevor Baxendale/Colin Brake/Claire Bartlett/Sarah Groenewegen/Trey Korte/Andy Frankham-Allen,eng,246,07/01/2004
20264,Gerontius,James Hamilton-Paterson,eng,272,4/17/2002
20287,Hellstrom's Hive,Frank Herbert,eng,312,3/23/1982
20315,The Dark City (Eliot Ness  #1),Max Allan Collins,eng,233,08/01/2005
20316,Bullet Proof (Eliot Ness  #3),Max Allan Collins,eng,197,12/20/2005
20323,The Penguin Companion to European Literature,Anthony Thorlby,eng,907,5/30/1969
20327,West To Eden,Gloria Goldreich,eng,501,12/01/1988
20343,The Various,Steve Augarde,eng,448,11/08/2005
20351,Truman Capote: In Which Various Friends  Enemies  Acquaintances  and Detractors Recall His Turbulent Career,George Plimpton,eng,498,11/10/1998
20355,The Burnt Orange Heresy,Charles Willeford,eng,144,12/20/1999
20367,Ewan McGregor: From Junkie to Jedi,Brian J. Robb,eng,144,05/05/1999
20381,Shadow Twin,Gardner Dozois/George R.R. Martin/Daniel Abraham,eng,114,06/01/2005
20394,Der Prophet,Kahlil Gibran,ger,95,09/01/2001
20398,Le prophète,Kahlil Gibran,fre,172,10/08/2002
20408,The Complete Stories of Robert Louis Stevenson: Strange Case of Dr. Jekyll and Mr. Hyde and Nineteen Other Tales,Robert Louis Stevenson/Barry Menikoff,eng,818,10/08/2002
20410,The Complete Short Stories Of Robert Louis Stevenson: With A Selection Of The Best Short Novels,Robert Louis Stevenson/Charles Neider,eng,720,8/22/1998
20413,A Child's Garden of Verses,Robert Louis Stevenson/Tasha Tudor,eng,67,02/01/1999
20417,Have Space Suit—Will Travel,Robert A. Heinlein,eng,276,02/08/2005
20420,Practicalities,Marguerite Duras/Barbara Bray,eng,143,10/22/1993
20422,Le ravissement de Lol V. Stein,Marguerite Duras,fre,192,6/25/1976
20423,India Song,Marguerite Duras/Barbara Bray,eng,146,1/13/1994
20424,Clown,Quentin Blake,eng,32,9/15/1998
20425,The Spiral Stair (Arabel and Mortimer  #6),Joan Aiken/Quentin Blake,eng,62,08/01/2000
20429,A Near Thing for Captain Najork (Captain Najork #2),Russell Hoban/Quentin Blake,eng,32,10/01/2006
20468,Cover Her Face (Adam Dalgliesh #1),P.D. James/Neville Teller/Robin Ellis/Sian Phillips/Hugh Grant,eng,2,05/07/2002
20498,Reptiles and Amphibians (Smithsonian Handbooks),Mark O'Shea/Tim Halliday/Jonathan Metcalf,eng,256,10/01/2002
20501,The Camera (Ansel Adams Photography  #1),Ansel Adams/Robert Hardy Baker,eng,195,06/01/1995
20502,The Negative (Ansel Adams Photography  #2),Ansel Adams/Robert Hardy Baker,eng,265,06/01/1995
20505,The Print (Ansel Adams Photography  #3),Ansel Adams/Robert Hardy Baker,eng,203,06/01/1995
20509,The Changing Status of the Artist,Emma Barker/Nick Webb/Kim W. Woods,eng,260,03/01/1999
20517,Vicars of Christ: A History of the Popes,Charles A. Coulombe,eng,492,07/01/2003
20518,The Big Bing: Black Holes of Time Management  Gaseous Executive Bodies  Exploding Careers  and Other Theories on the Origins of the Business Universe,Stanley Bing,eng,368,01/03/2006
20519,What Would Machiavelli Do?: The Ends Justify the Meanness,Stanley Bing,eng,176,7/28/2004
20525,William James: In the Maelstrom of American Modernism,Robert D. Richardson Jr.,eng,622,11/09/2006
20531,Cliffs Notes on Wright's Black Boy,Carl Senna/CliffsNotes/Richard Wright,eng,56,05/05/1971
20547,The Wit and Wisdom of Abraham Lincoln: A Book of Quotations,Abraham Lincoln/Bob Blaisdell,eng,96,08/08/2005
20549,Speeches and Writings 1832–1858,Abraham Lincoln/Don E. Fehrenbacher,eng,898,10/01/1989
20552,Selected Speeches and Writings,Abraham Lincoln/Gore Vidal,eng,515,2/18/1992
20562,George Eliot: The Last Victorian,Kathryn  Hughes,eng,416,07/02/2001
20564,The Mill on the Floss,George Eliot/A.S. Byatt,eng,579,2/27/2003
20567,Scenes of Clerical Life,George Eliot/Thomas A. Noble,eng,310,1/24/2002
20645,Terry Jones' Medieval Lives,Terry Jones/Alan Ereira,eng,240,05/05/2005
20646,Terry Jones' Fairy Tales,Terry Jones/Michael Foreman,eng,160,06/01/1993
20657,Some Ether,Nick Flynn,eng,85,05/01/2000
20660,Tin House: Evil (Volume 8 no. 3),Chris Adrian/Nick Flynn/Francine Prose/Josip Novakovich/Moonshine,eng,224,04/06/2007
20661,A Note Slipped Under the Door: Teaching from Poems We Love,Nick Flynn/Shirley McPhillips/Philippa Stratton,eng,256,01/01/2000
20668,The Trouble with Testosterone and Other Essays on the Biology of the Human Predicament,Robert M. Sapolsky,eng,288,4/24/1998
20671,Monkeyluv: And Other Essays on Our Lives as Animals,Robert M. Sapolsky,en-CA,209,10/10/2006
20677,Literary Criticism  Vol. 1: Essays on Literature / American Writers / English Writers,Henry James/Leon Edel/Mark Wilson,eng,1504,12/01/1984
20679,Advanced Statistics Demystified,Larry J. Stephens,eng,324,06/07/2004
20687,Lilly's Big Day,Kevin Henkes,eng,40,3/28/2006
20692,Chester's Way,Kevin Henkes,eng,32,9/22/1997
20694,Julius  the Baby of the World,Kevin Henkes,eng,32,9/21/1995
20738,Forms of Talk,Erving Goffman,eng,344,03/01/1981
20741,Interaction Ritual - Essays on Face-to-Face Behavior,Erving Goffman,eng,288,01/12/1982
20749,Study Bible: NIV,Anonymous,eng,2198,10/01/2002
20775,My Lord Eternity (Immortal Rogues  #2),Debbie Raleigh/Alexandra Ivy,eng,256,10/01/2003
20781,Aesop's Fables,Aesop/Ann McGovern,eng,80,11/01/1963
20794,Once A Wolf: How Wildlife Biologists Fought to Bring Back the Gray Wolf,Stephen R. Swinburne/Jim Brandenburg,eng,48,2/26/2001
20800,Conversations with Don DeLillo,Don DeLillo/Thomas DePietro,eng,183,1/13/2005
20807,Inventing America: Jefferson's Declaration of Independence,Garry Wills,eng,432,11/14/2002
20809,Lincoln at Gettysburg: The Words That Remade America,Garry Wills,eng,320,11/14/2006
20810,Venice: Lion City: The Religion of Empire,Garry Wills,eng,416,09/03/2002
20812,Four Weddings and a Funeral,Richard Curtis,eng,128,4/15/1996
20813,Halloween,Richard Curtis,eng,166,09/01/1982
20833,Janet  My Mother and Me: A Memoir of Growing Up with Janet Flanner and Natalia Danesi Murray,William Murray,eng,320,2/17/2000
20848,Catch That Pass!,Matt Christopher,eng,130,09/01/1989
20862,Divide and Conquer (Tom Clancy's Op-Center  #7),Jeff Rovin/Tom Clancy/Steve Pieczenik,eng,372,06/12/2000
20865,Death Match (Tom Clancy's Net Force Explorers  #18),Diane Duane/Tom Clancy/Steve Pieczenik,eng,192,07/01/2003
20867,Line of Control (Tom Clancy's Op-Center  #8),Jeff Rovin/Tom Clancy/Steve Pieczenik,eng,384,06/05/2001
20868,Sea of Fire (Tom Clancy's Op-Center  #10),Jeff Rovin/Tom Clancy/Steve Pieczenik,eng,400,6/24/2003
20869,One is the Loneliest Number (Tom Clancy's Net Force Explorers  #3),Diane Duane/Tom Clancy/Steve Pieczenik,eng,182,04/01/1999
20873,Aliens: Nightmare Asylum,Steve Perry,eng,277,04/01/1993
20876,The Omega Cage (Matador  #4),Steve Perry/Michael Reaves,eng,256,04/01/1988
20879,The 97th Step (Matador  #5),Steve Perry,eng,304,12/01/1989
20891,A Friar's Bloodfeud (Knights Templar  #20),Michael Jecks,eng,500,06/05/2006
20895,Death Ship of Dartmouth (Knights Templar  #21),Michael Jecks,eng,352,06/01/2006
20913,The John Deere Two-Cylinder Tractor Encyclopedia: The Complete Model-by-Model History,Don Macmillan/Wayne G. Broehl Jr.,eng,256,5/15/2007
20928,Phantoms,Rosalind M. Greenberg,eng,270,04/04/1989
20929,Fantasy Gone Wrong,Martin H. Greenberg/Brittiany A. Koren/Brian Stableford/Mickey Zucker Reichert/Fiona Patton/Jim C. Hines/Esther M. Friesner/Donald J. Bingle/Alan Dean Foster/Devon Monk/Phaedra M. Weldon/Christina F. York/Jana Paniccia/Josepha Sherman/Susan Sizemore/Michael Jasper/Janny Wurts/Lisanne Norman,eng,309,09/05/2006
20930,The Ghosts in Baker Street: New Tales of Sherlock Holmes,Martin H. Greenberg/Daniel Stashower,eng,320,01/09/2006
20932,Christmas Bestiary,Martin H. Greenberg/Jack Nimersheim/Jane Yolen/Jack C. Haldeman II/Harry Turtledove/Laura Resnick/Mike Resnick/Karen Haber/Jane Lindskold/Lawrence Schimel/Barry N. Malzberg/Tanya Huff/Michelle Sagara West/Mark Aronson/Stefan R. Dziemianowicz/Jennifer Roberson/Kristine Kathryn Rusch/Elizabeth Ann Scarborough/Barbara Delaplace/Barb Jernigan/Blake Cahoon,eng,315,11/03/1992
20934,Black Cats and Broken Mirrors,John Helfers/Esther M. Friesner/Nina Kiriki Hoffman/Bruce Holland Rogers/Peter Crowther/R. Davis/Charles de Lint/Elizabeth Ann Scarborough/Michelle Sagara West/Nancy Springer/Dean Wesley Smith/Kristine Kathryn Rusch/Josepha Sherman/Jane Lindskold/Genevieve Gorman/Kristin Schwengel/Jean-François Podevin/Zane Stillings/Carol Rondou,eng,320,06/01/1998
20935,Time Twisters,Jean Rabe/Martin H. Greenberg/Stephen Leigh/Gene DeWeese/Joe Masdon/Donald J. Bingle/Skip Williams/Penny Williams/Pierce Askegren/Nancy Virginia Varian/Wes Nicholson/John Helfers/Chris Pierson/Harry Turtledove/Kevin J. Anderson/Robert E. Vardeman/Jackie Cassada/James M. Ward/Jon L. Breen/Linda P. Baker,eng,306,01/02/2007
20941,The Western Canon: The Books and School of the Ages,Harold Bloom,eng,546,09/01/1995
20942,Shakespeare: The Invention of the Human,Harold Bloom,eng,745,09/01/1999
20944,The American Religion,Harold Bloom,en-GB,305,10/01/2006
20949,American Caesar: Douglas MacArthur 1880-1964,William Manchester,eng,811,9/30/1978
20954,Winchester Shotguns,Dennis Adler/R.L. Wilson,eng,372,5/15/2008
20957,Colossians and Philemon: A Critical and Exegetical Commentary (International Critical Commentary),R. McL. Wilson,eng,512,12/07/2005
20962,Maurice Sendak's Seven Little Monsters: What Time is It? - Book #4,Arthur Yorinks/Raymond Jafelice,eng,24,04/05/2004
20971,Meditations for Manifesting: Morning and Evening Meditations to Literally Create Your Heart's Desire,Wayne W. Dyer,eng,1,06/01/1995
20972,There's a Spiritual Solution to Every Problem,Wayne W. Dyer,eng,288,8/21/2001
21004,Michael Smith Elements of Style,Michael S.  Smith/Diane Dorrans Saeks,eng,212,11/22/2005
21010,Spares,Michael Marshall Smith,eng,317,11/02/1998
21012,One of Us,Michael Marshall Smith,eng,368,07/06/1999
21016,The Secret City (Pyrates  #1),Chris Archer,eng,184,02/01/2003
21029,The Theory and Practice of Group Psychotherapy,Irvin D. Yalom/Molyn Leszcz,eng,688,07/06/2005
21031,When Nietzsche Wept,Irvin D. Yalom,eng,310,01/04/2005
21032,Existential Psychotherapy,Irvin D. Yalom,eng,544,12/08/1980
21059,Crown of Stars (Crown of Stars  #7),Kate Elliott,eng,609,01/02/2007
21060,Crown Duel (Crown & Court #1-2),Sherwood Smith,eng,471,06/10/2002
21062,A Rose for the Crown,Anne Easter Smith,eng,650,3/14/2006
21063,The Bloody Crown of Conan (Conan the Cimmerian  #2),Robert E. Howard/Gary Gianni/Patrice Louinet,eng,366,11/23/2004
21070,Rough Crossings: Britain  the Slaves and the American Revolution,Simon Schama,eng,496,4/25/2006
21071,Landscape and Memory,Simon Schama,eng,672,11/05/1996
21073,The Embarrassment of Riches: An Interpretation of Dutch Culture in the Golden Age,Simon Schama,eng,720,12/08/1997
21075,Citizens: A Chronicle of the French Revolution,Simon Schama,en-GB,825,08/05/2004
21089,The Feelings Book: The Care & Keeping of Your Emotions,Lynda Madison/Bonnie Timmons/Norm Bendell,eng,104,09/01/2002
21091,A Smart Girl's Guide to Money: How to Make It  Save It  And Spend It,Nancy Holyoke/Ali Douglass,en-GB,95,03/01/2006
21093,What Would You Do? (American Girl Library),Patti Kelley Criswell/Norm Bendell,eng,63,07/01/2004
21107,The Halloween Activity Book: Creepy  Crawly  Hairy  Scary Things to Do,Mymi Doinet/Benjamin Chaud,eng,32,08/01/2002
21114,The Capricorn Stone,Madeleine Brent,eng,346,05/12/1983
21116,Golden Urchin,Madeleine Brent,en-GB,384,11/12/1987
21119,The Ethics of Ambiguity,Simone de Beauvoir/Bernard Frechtman,eng,162,06/01/2000
21121,She Came to Stay,Simone de Beauvoir,en-GB,416,10/09/1995
21122,The Coming of Age,Simone de Beauvoir/Patrick O'Brian,en-GB,592,6/17/1996
21125,A Transatlantic Love Affair: Letters to Nelson Algren,Simone de Beauvoir/Nelson Algren/Sylvie Le Bon de Beauvoir/Vanessa Kling/Ellen Gordon Reeves,eng,560,09/01/1999
21126,La force de l'âge,Simone de Beauvoir,fre,786,11/14/1986
21143,What Life Was Like When Rome Ruled the World: The Roman Empire  100 BC - AD 200 (What Life Was Like),Time-Life Books,eng,192,5/24/1999
21151,Sudden Fiction International: 60 Short-Short Stories,Robert Shapard/James Thomas,eng,352,10/17/1989
21152,Sudden Fiction: American Short-Short Stories,Robert Shapard/James Thomas,eng,264,12/31/1983
21173,Sarah Bernhardt,Elizabeth Silverthorne/Betty McCollum,eng,136,01/01/2004
21179,The Art of Controversy (The Essays of Arthur Schopenhauer),Thomas Bailey Saunders,eng,76,6/17/2004
21182,The Wisdom of Life,Arthur Schopenhauer/Thomas Bailey Saunders,eng,96,03/08/2004
21187,For All Time (Time Travelers  #4),Caroline B. Cooney,eng,261,07/08/2003
21188,Wanted!,Caroline B. Cooney,eng,230,07/01/1997
21191,The Time Travelers: Volume One,Caroline B. Cooney,eng,420,01/10/2006
21194,The Stranger,Caroline B. Cooney,eng,198,11/01/1993
21199,Every Night Italian: Every Night Italian,Giuliano Hazan/Marcella Hazan/Dana Gallagher,eng,256,01/12/2000
21200,More Classic Italian Cooking,Marcella Hazan,eng,465,07/12/1984
21214,Practice Makes Perfect: Italian Verb Tenses,Paola Nanni-Tate,eng,252,11/23/2005
21220,Effigies (Faye Longchamp  #3),Mary Anna Evans,eng,301,1/15/2007
21223,The Cambridge Companion to Schopenhauer,Christopher Janaway,eng,494,1/20/2000
21230,Stormie: A Story of Forgiveness and Healing,Stormie Omartian,eng,192,09/01/1997
21242,The Orion Mystery: Unlocking the Secrets of the Pyramids,Robert Bauval/Adrian Geoffrey Gilbert,eng,352,8/22/1995
21245,Orion (Orion  #1),Ben Bova,eng,432,12/15/1992
21248,Lake Orion (Images of America: Michigan),James E. Ingram/Lori Grove,eng,128,7/19/2006
21266,Rick Steves' Europe Through the Back Door,Rick Steves,eng,808,09/12/2017
21276,A Dangerous Man (Hank Thompson  #3),Charlie Huston,eng,286,9/19/2006
21277,Already Dead (Joe Pitt  #1),Charlie Huston,eng,268,12/27/2005
21278,Caught Stealing (Hank Thompson  #1),Charlie Huston,eng,240,5/31/2005
21280,Ultimate Annuals  Volume 2,Charlie Huston/Mike Carey/Brian Michael Bendis/Robert Kirkman/Mike Deodato/Ryan Sook/Stuart Immonen/Frazier Irving,eng,160,02/07/2007
21282,Dead I Well May Be (Dead Trilogy #1),Adrian McKinty,eng,384,8/31/2004
21283,The Dead Yard (Michael Forsythe #2),Adrian McKinty,eng,364,12/26/2006
21284,The Lighthouse Land (Lighthouse Trilogy #1),Adrian McKinty,eng,387,10/01/2006
21290,Spider Mountain (Cam Richter  #2),P.T. Deutermann,eng,309,12/26/2006
21294,The Edge of Honor,P.T. Deutermann,eng,626,5/15/1995
21295,The Firefly,P.T. Deutermann,eng,528,11/30/2004
21315,Diary of a Spider,Doreen Cronin/Harry Bliss,eng,40,7/26/2005
21318,The Snow Spider (Snow Spider Trilogy  #1),Jenny Nimmo,eng,146,09/01/2006
21320,Ultimate Spider-Man  Volume 16: Deadpool,Brian Michael Bendis/Mark Bagley,eng,184,9/13/2006
21321,Ultimate Spider-Man  Volume 7,Brian Michael Bendis/Mark Bagley,eng,344,10/04/2006
21322,Fables: 1001 Nights of Snowfall,Bill Willingham/Esao Andrews/John Bolton/Mark Buckingham/James Jean/Derek Kirk Kim/Tara  McPherson/Jill Thompson/Mark Wheatley/Michael Wm. Kaluta/Charles Vess/Brian Bolland,eng,140,10/18/2006
21323,Cold Fire / Hideaway / The Key to Midnight,Dean Koontz/Leigh Nichols,eng,784,8/28/2000
21324,Fables  Vol. 8: Wolves,Bill Willingham/Mark Buckingham/Steve Leialoha/Shawn McManus/Andrew Pepoy,eng,160,12/20/2006
21325,Fables  Vol. 4: March of the Wooden Soldiers,Bill Willingham/Mark Buckingham/Craig Hamilton/Steve Leialoha/P. Craig Russell,eng,231,11/30/2004
21326,Fables  Vol. 1: Legends in Exile,Bill Willingham/Terry Moore/Mike Allred/Lan Medina/Mark Buckingham/Matthew Sturges/Steve Leialoha/Craig Hamilton/Russ Braun/James Jean/Tony Akins/Eric Shanower/Shawn McManus/Jae Lee/Chrissie Zullo/David Petersen,eng,128,12/31/2002
21327,Fables  Vol. 7: Arabian Nights (and Days),Bill Willingham/Mark Buckingham/Steve Leialoha/Jim Fern/Jimmy Palmiotti/Andrew Pepoy,eng,143,07/05/2006
21328,Fables  Vol. 6: Homelands,Bill Willingham/David Hahn/Mark Buckingham/Lan Medina/Steve Leialoha,eng,190,1/27/2006
21329,Fables  Vol. 3: Storybook Love,Bill Willingham/Bryan Talbot/Lan Medina/Mark Buckingham/Linda Medley/Steve Leialoha/James Jean,eng,190,05/01/2004
21330,Fables  Vol. 5: The Mean Seasons,Bill Willingham/Mark Buckingham/Steve Leialoha/Tony Akins/Jimmy Palmiotti,eng,166,4/30/2005
21332,The Choice: A Fable of Free Trade and Protectionism,Russell Roberts/Russ Roberts,eng,132,09/01/2006
21338,Brewer's Dictionary of Phrase and Fable,John Ayto,eng,1326,8/15/2006
21341,Jack of Fables  Vol. 1: The (Nearly) Great Escape,Bill Willingham/Matthew Sturges/Tony Akins/Andrew Pepoy,eng,128,2/28/2007
21342,Math Fables,Greg Tang/Heather Cahoon,eng,40,01/01/1949
21343,The Five Dysfunctions of a Team: A Leadership Fable,Patrick Lencioni,eng,227,04/11/2002
21348,Aesop's Fables,Aesop/Laura Harris/Laura Gibbs,eng,306,04/10/2003
21352,Icebound,David Axton/Dean Koontz/Paul Michael,eng,0,03/06/2007
21353,Odd Thomas (Odd Thomas #1),Dean Koontz/David Baker,eng,11,12/09/2003
21362,Seize the Night (Moonlight Bay  #2),Dean Koontz/Keith Szarabajka,eng,12,12/29/1998
21365,From the Corner of His Eye,Dean Koontz/Stephen Lang,eng,0,12/26/2000
21370,The Good Guy,Dean Koontz/Richard Ferrrone,eng,9,5/29/2007
21402,Pompeii,Robert   Harris/Michael Cumpsty,eng,0,09/05/2006
21425,3rd Degree,James Patterson/Andrew Gross/Carolyn McCormick,eng,7,03/01/2004
21426,2nd Chance (Women's Murder Club #2),James Patterson/Melissa Leo/Jeremy Piven/Andrew Gross,eng,5,2/27/2006
21430,The Big Bad Wolf,James Patterson/Peter J. Fernandez/Denis O'Hare,eng,8,11/01/2003
21437,Pop Goes the Weasel,James Patterson/Roger Rees/Keith David,en-GB,460,11/13/2006
21484,The Winds of War (The Henry Family  #1),Herman Wouk,eng,896,02/05/2002
21489,Hollywood Station (Hollywood Station  #1),Joseph Wambaugh,eng,340,01/03/2007
21491,The Choirboys,Joseph Wambaugh,eng,368,4/18/2002
21493,Fire Lover: A True Story,Joseph Wambaugh,eng,352,4/30/2002
21494,Floaters,Joseph Wambaugh,eng,291,03/03/1997
21495,The New Centurions,Joseph Wambaugh,eng,368,03/01/1987
21498,The Black Marble,Joseph Wambaugh,eng,416,09/02/1998
21505,The Secrets of Harry Bright,Joseph Wambaugh,eng,307,05/07/1987
21508,Lines and Shadows,Joseph Wambaugh,eng,416,11/01/1995
21527,Hollywood Tough (Shane Scully  #3),Stephen J. Cannell/Paul Michael/Michael Prichard,eng,10,01/07/2003
21530,Cold Hit (Shane Scully #5),Stephen J. Cannell/Scott Brick,eng,11,08/01/2005
21534,Trunk Music (Harry Bosch  #5; Harry Bosch Universe  #6),Michael Connelly/Dick Hill,eng,13,11/28/2006
21535,Angels Flight (Harry Bosch  #6),Michael Connelly/Dick Hill,eng,9,7/25/2005
21536,The Black Echo (Harry Bosch  #1; Harry Bosch Universe  #1),Michael Connelly/Dick Hill,eng,12,11/25/2006
21538,The Closers (Harry Bosch  #11; Harry Bosch Universe  #14),Michael Connelly/Len Cariou,eng,12,05/01/2005
